A1: 选手名字 | B1: 所属队伍 | C1: 位置 | D1: Mvp | E1: 分均经济 | F1: 分均补刀 | G1: 分均伤害 | H1: 伤害占比 | I1: 分均承伤 | J1: 承伤占比 | K1: 分均放眼 | L1: 分均拆眼 | M1: 伤害/经济 | N1: 承伤/经济 | O1: 出场次数 | P1: KDA | Q1: 场均参团率
A2: Doinb | B2: JDG | C2: 中单 | D2: 7 | E2: 427.7 | F2: 9.4 | G2: 700.5 | H2: 36.9 | I2: 590.2 | J2: 20.2 | K2: 0.2 | L2: 0.3 | M2: =G2/E2 -> 1.6378302548515316 | N2: =I2/E2 -> 1.379939209726444 | O2: 38 | P2: 3.4 | Q2: 79.1
A3: vasilii | B3: NB | C3: ADC | D3: 1 | E3: 437.7 | F3: 8.8 | G3: 711.6 | H3: 6.8 | I3: 426 | J3: 2.8 | K3: 0.2 | L3: 0.3 | M3: =G3/E3 -> 1.6257710760795065 | N3: =I3/E3 -> 0.97326936257710761 | O3: 8 | P3: 5.7 | Q3: 79.3
A4: Bananafish | B4: SNG | C4: ADC | D4: 1 | E4: 438.1 | F4: 9 | G4: 692.7 | H4: 3.3 | I4: 408.2 | J4: 1.3 | K4: 0.3 | L4: 0.3 | M4: =G4/E4 -> 1.5811458571102488 | N4: =I4/E4 -> 0.93175074183976259 | O4: 4 | P4: 4.3 | Q4: 81.2
A5: Athena | B5: IM | C5: 中单 | D5: 1 | E5: 393.5 | F5: 8.9 | G5: 613.6 | H5: 30.5 | I5: 473.6 | J5: 15.4 | K5: 0.3 | L5: 0.2 | M5: =G5/E5 -> 1.5593392630241423 | N5: =I5/E5 -> 1.2035578144853876 | O5: 38 | P5: 3.1 | Q5: 75.4
A6: Rookie | B6: iG | C6: 中单 | D6: 9 | E6: 419.8 | F6: 9 | G6: 651.3 | H6: 29.7 | I6: 499.9 | J6: 17.4 | K6: 0.3 | L6: 0.2 | M6: =G6/E6 -> 1.5514530728918532 | N6: =I6/E6 -> 1.1908051453072892 | O6: 55 | P6: 4.3 | Q6: 73.4
A7: Y4 | B7: RNG | C7: ADC | D7: 1 | E7: 434.4 | F7: 9.2 | G7: 476.4 | H7: 7.2 | I7: 379.9 | J7: 4.3 | K7: 0.3 | L7: 0.2 | M7: =G7/E7 -> 1.0966850828729282 | N7: =I7/E7 -> 0.87453959484346222 | O7: 15 | P7: 5.5 | Q7: 73.7
A8: xiaohu | B8: RNG | C8: 中单 | D8: 10 | E8: 424.4 | F8: 9.1 | G8: 645.9 | H8: 31 | I8: 436 | J8: 15.7 | K8: 0.3 | L8: 0.2 | M8: =G8/E8 -> 1.5219132893496701 | N8: =I8/E8 -> 1.0273327049952876 | O8: 48 | P8: 6.4 | Q8: 76.3
A9: IBoy | B9: EDG | C9: ADC | D9: 1 | E9: 438.6 | F9: 9.7 | G9: 542.8 | H9: 13.5 | I9: 429.4 | J9: 7.6 | K9: 0.4 | L9: 0.3 | M9: =G9/E9 -> 1.2375740994072046 | N9: =I9/E9 -> 0.97902416780665746 | O9: 22 | P9: 4.5 | Q9: 65
A10: Zet | B10: EDG | C10: ADC | D10: 2 | E10: 417.9 | F10: 8.4 | G10: 521.7 | H10: 12.6 | I10: 379.1 | J10: 6.5 | K10: 0.4 | L10: 0.2 | M10: =G10/E10 -> 1.2483847810480979 | N10: =I10/E10 -> 0.90715482172768613 | O10: 22 | P10: 5.4 | Q10: 69.7
A11: OHQ | B11: Snake | C11: ADC | D11: 1 | E11: 397.9 | F11: 8.7 | G11: 501.6 | H11: 15.6 | I11: 384.9 | J11: 8 | K11: 0.3 | L11: 0.2 | M11: =G11/E11 -> 1.2606182457903998 | N11: =I11/E11 -> 0.96732847449107817 | O11: 25 | P11: 4.2 | Q11: 68.2
A12: scout | B12: EDG | C12: 中单 | D12: 11 | E12: 424.5 | F12: 8.6 | G12: 634.5 | H12: 31.1 | I12: 521.3 | J12: 18.3 | K12: 0.4 | L12: 0.2 | M12: =G12/E12 -> 1.4946996466431095 | N12: =I12/E12 -> 1.2280329799764427 | O12: 44 | P12: 5 | Q12: 76.7
A13: CoCo | B13: NB | C13: 中单 | D13: 5 | E13: 405.3 | F13: 8.3 | G13: 603.1 | H13: 17.8 | I13: 463.7 | J13: 9.6 | K13: 0.3 | L13: 0.2 | M13: =G13/E13 -> 1.4880335553910684 | N13: =I13/E13 -> 1.1440907969405378 | O13: 27 | P13: 5.3 | Q13: 74.1
A14: Loken | B14: JDG | C14: ADC | D14: 1 | E14: 416.3 | F14: 9.1 | G14: 526.7 | H14: 22 | I14: 415.6 | J14: 11.2 | K14: 0.3 | L14: 0.2 | M14: =G14/E14 -> 1.2651933701657458 | N14: =I14/E14 -> 0.99831852029786217 | O14: 30 | P14: 3.9 | Q14: 77.8
A15: Ggoong | B15: DAN | C15: 中单 | D15: 6 | E15: 402.3 | F15: 8.8 | G15: 589.7 | H15: 24.5 | I15: 431.2 | J15: 12.2 | K15: 0.4 | L15: 0.2 | M15: =G15/E15 -> 1.4658215262242109 | N15: =I15/E15 -> 1.0718369376087495 | O15: 31 | P15: 4 | Q15: 75.7
A16: West | B16: iG | C16: ADC | D16: 4 | E16: 431.4 | F16: 9.5 | G16: 559.7 | H16: 25.5 | I16: 434.2 | J16: 15.1 | K16: 0.3 | L16: 0.2 | M16: =G16/E16 -> 1.2974038015762634 | N16: =I16/E16 -> 1.0064904960593417 | O16: 55 | P16: 3.6 | Q16: 63.9
A17: Guoguo | B17: Snake | C17: 中单 | D17: 0 | E17: 384.7 | F17: 8.4 | G17: 560 | H17: 3.6 | I17: 575.8 | J17: 2.4 | K17: 0.2 | L17: 0.2 | M17: =G17/E17 -> 1.4556797504548999 | N17: =I17/E17 -> 1.4967507148427346 | O17: 5 | P17: 3.4 | Q17: 78.3
A18: Qiuqiu | B18: DAN | C18: ADC | D18: 3 | E18: 400.5 | F18: 8.8 | G18: 542.2 | H18: 23.3 | I18: 397.5 | J18: 11.6 | K18: 0.4 | L18: 0.2 | M18: =G18/E18 -> 1.3538077403245943 | N18: =I18/E18 -> 0.99250936329588013 | O18: 32 | P18: 3.2 | Q18: 73.8
A19: qi | B19: DAN | C19: 中单 | D19: 0 | E19: 388.4 | F19: 8.9 | G19: 548.7 | H19: 5 | I19: 540.7 | J19: 3.3 | K19: 0.5 | L19: 0.1 | M19: =G19/E19 -> 1.4127188465499487 | N19: =I19/E19 -> 1.3921215242018539 | O19: 7 | P19: 1.8 | Q19: 66.6
A20: Cool | B20: LGD | C20: 中单 | D20: 3 | E20: 400.5 | F20: 8.7 | G20: 557.6 | H20: 27.8 | I20: 411 | J20: 14.7 | K20: 0.2 | L20: 0.2 | M20: =G20/E20 -> 1.3922596754057428 | N20: =I20/E20 -> 1.0262172284644195 | O20: 39 | P20: 3.2 | Q20: 70.7
A21: imp | B21: LGD | C21: ADC | D21: 3 | E21: 423.2 | F21: 9.2 | G21: 615.8 | H21: 30.7 | I21: 443.7 | J21: 15.8 | K21: 0.4 | L21: 0.3 | M21: =G21/E21 -> 1.4551039697542532 | N21: =I21/E21 -> 1.0484404536862004 | O21: 39 | P21: 3.3 | Q21: 68.1
A22: Zz1tai | B22: Snake | C22: 中单 | D22: 3 | E22: 409.2 | F22: 8.9 | G22: 553.8 | H22: 24.1 | I22: 484.6 | J22: 14.1 | K22: 0.3 | L22: 0.1 | M22: =G22/E22 -> 1.3533724340175952 | N22: =I22/E22 -> 1.1842619745845553 | O22: 37 | P22: 4 | Q22: 73.4
A23: Icon | B23: OMG | C23: 中单 | D23: 5 | E23: 411.5 | F23: 8.8 | G23: 543.8 | H23: 28 | I23: 479.3 | J23: 16.9 | K23: 0.4 | L23: 0.1 | M23: =G23/E23 -> 1.3215066828675577 | N23: =I23/E23 -> 1.1647630619684084 | O23: 43 | P23: 4.7 | Q23: 76.1
A24: jinjiao | B24: IM | C24: ADC | D24: 3 | E24: 394.5 | F24: 9 | G24: 575.6 | H24: 28.6 | I24: 386.4 | J24: 12.6 | K24: 0.3 | L24: 0.3 | M24: =G24/E24 -> 1.4590621039290241 | N24: =I24/E24 -> 0.97946768060836498 | O24: 38 | P24: 2.6 | Q24: 72.1
A25: The Shy | B25: iG | C25: 上单 | D25: 1 | E25: 396.6 | F25: 8.3 | G25: 514.2 | H25: 10.6 | I25: 740.3 | J25: 11.7 | K25: 0.5 | L25: 0.1 | M25: =G25/E25 -> 1.2965204236006052 | N25: =I25/E25 -> 1.866616238023197 | O25: 26 | P25: 2.3 | Q25: 57.7
A26: Moyu | B26: DAN | C26: 上单 | D26: 1 | E26: 358.6 | F26: 7.6 | G26: 459 | H26: 3.9 | I26: 636 | J26: 3.6 | K26: 0.4 | L26: 0.1 | M26: =G26/E26 -> 1.2799776910206357 | N26: =I26/E26 -> 1.77356385945343 | O26: 6 | P26: 1.3 | Q26: 61.9
A27: xiye | B27: WE | C27: 中单 | D27: 6 | E27: 413.5 | F27: 8.8 | G27: 526.2 | H27: 26.3 | I27: 478 | J27: 16 | K27: 0.3 | L27: 0.2 | M27: =G27/E27 -> 1.2725513905683192 | N27: =I27/E27 -> 1.1559854897218864 | O27: 53 | P27: 5.1 | Q27: 71.7
A28: Fury | B28: SNG | C28: ADC | D28: 7 | E28: 419.4 | F28: 9.5 | G28: 623.5 | H28: 29.4 | I28: 388.2 | J28: 12.2 | K28: 0.4 | L28: 0.3 | M28: =G28/E28 -> 1.4866475917978064 | N28: =I28/E28 -> 0.92560801144492133 | O28: 39 | P28: 4.5 | Q28: 74.5
A29: Uzi | B29: RNG | C29: ADC | D29: 3 | E29: 456.9 | F29: 10 | G29: 683.7 | H29: 21.1 | I29: 399.9 | J29: 9.2 | K29: 0.3 | L29: 0.3 | M29: =G29/E29 -> 1.4963887065003285 | N29: =I29/E29 -> 0.87524622455679579 | O29: 31 | P29: 6.7 | Q29: 71.3
A30: wuxx | B30: RNG | C30: ADC | D30: 0 | E30: 377.1 | F30: 9.5 | G30: 475.1 | H30: 0.8 | I30: 326.6 | J30: 0.4 | K30: 0.2 | L30: 0.1 | M30: =G30/E30 -> 1.2598780164412622 | N30: =I30/E30 -> 0.86608326703792093 | O30: 2 | P30: 3.3 | Q30: 62.5
A31: Corn | B31: NB | C31: 中单 | D31: 2 | E31: 388 | F31: 8.7 | G31: 488.4 | H31: 9.4 | I31: 515.1 | J31: 7 | K31: 0.5 | L31: 0.1 | M31: =G31/E31 -> 1.2587628865979381 | N31: =I31/E31 -> 1.327577319587629 | O31: 18 | P31: 2.5 | Q31: 64.4
A32: Flandre | B32: Snake | C32: 上单 | D32: 5 | E32: 387.2 | F32: 8.5 | G32: 483.6 | H32: 24.2 | I32: 826.8 | J32: 27.7 | K32: 0.4 | L32: 0.1 | M32: =G32/E32 -> 1.2489669421487604 | N32: =I32/E32 -> 2.1353305785123968 | O32: 42 | P32: 2.9 | Q32: 76.2
A33: MyStic | B33: WE | C33: ADC | D33: 13 | E33: 442.7 | F33: 9.5 | G33: 669.8 | H33: 33.5 | I33: 453.9 | J33: 15.2 | K33: 0.3 | L33: 0.4 | M33: =G33/E33 -> 1.5129884797831488 | N33: =I33/E33 -> 1.0252992997515247 | O33: 53 | P33: 4.5 | Q33: 73.7
A34: fenfen | B34: SNG | C34: 中单 | D34: 2 | E34: 393.7 | F34: 8.5 | G34: 491.1 | H34: 18.3 | I34: 561.4 | J34: 13.9 | K34: 0.4 | L34: 0.2 | M34: =G34/E34 -> 1.2473964947929896 | N34: =I34/E34 -> 1.4259588519177038 | O34: 31 | P34: 3.4 | Q34: 68.5
A35: Dian | B35: SNG | C35: 中单 | D35: 1 | E35: 394.8 | F35: 9.2 | G35: 491.7 | H35: 7.2 | I35: 463.5 | J35: 4.5 | K35: 0.3 | L35: 0.3 | M35: =G35/E35 -> 1.2454407294832825 | N35: =I35/E35 -> 1.1740121580547112 | O35: 12 | P35: 3.4 | Q35: 73.7
A36: Smlz | B36: OMG | C36: ADC | D36: 7 | E36: 432.5 | F36: 9.6 | G36: 657.9 | H36: 31.6 | I36: 434 | J36: 14.3 | K36: 0.3 | L36: 0.3 | M36: =G36/E36 -> 1.5211560693641617 | N36: =I36/E36 -> 1.0034682080924855 | O36: 40 | P36: 3.6 | Q36: 71.9
A37: Skye | B37: NB | C37: 上单 | D37: 1 | E37: 380.6 | F37: 8.1 | G37: 458.1 | H37: 14.1 | I37: 710.9 | J37: 15.5 | K37: 0.4 | L37: 0.1 | M37: =G37/E37 -> 1.2036258539148712 | N37: =I37/E37 -> 1.8678402522333157 | O37: 28 | P37: 3.4 | Q37: 66.3
A38: Natz | B38: DAN | C38: ADC | D38: 0 | E38: 362.3 | F38: 8.2 | G38: 430.1 | H38: 3.3 | I38: 467.7 | J38: 2.4 | K38: 0.4 | L38: 0.2 | M38: =G38/E38 -> 1.1871377311620204 | N38: =I38/E38 -> 1.2909191277946452 | O38: 6 | P38: 1.5 | Q38: 64.8
A39: Duke | B39: iG | C39: 上单 | D39: 1 | E39: 381.9 | F39: 8.4 | G39: 443.3 | H39: 11 | I39: 741.8 | J39: 14.1 | K39: 0.4 | L39: 0.1 | M39: =G39/E39 -> 1.1607750720083791 | N39: =I39/E39 -> 1.9423932966745221 | O39: 29 | P39: 3.3 | Q39: 61.7
A40: kRYST4L | B40: Snake | C40: 辅助 | D40: 0 | E40: 353 | F40: 5.7 | G40: 408.7 | H40: 14.7 | I40: 440.8 | J40: 10.6 | K40: 1 | L40: 0.5 | M40: =G40/E40 -> 1.1577903682719546 | N40: =I40/E40 -> 1.2487252124645893 | O40: 31 | P40: 2.8 | Q40: 74.2
A41: Banana | B41: LGD | C41: 上单 | D41: 0 | E41: 364.8 | F41: 8.1 | G41: 413.3 | H41: 5.7 | I41: 995.9 | J41: 9.9 | K41: 0.4 | L41: 0 | M41: =G41/E41 -> 1.1329495614035088 | N41: =I41/E41 -> 2.7299890350877192 | O41: 10 | P41: 1.5 | Q41: 57.4
A42: Jinoo | B42: LGD | C42: 上单 | D42: 1 | E42: 380 | F42: 8.1 | G42: 428.1 | H42: 15.3 | I42: 678.1 | J42: 17.4 | K42: 0.5 | L42: 0.1 | M42: =G42/E42 -> 1.1265789473684211 | N42: =I42/E42 -> 1.7844736842105264 | O42: 29 | P42: 2.2 | Q42: 58.7
A43: Lies | B43: DAN | C43: 上单 | D43: 0 | E43: 373.3 | F43: 8.4 | G43: 417.7 | H43: 17.7 | I43: 705.8 | J43: 20.4 | K43: 0.5 | L43: 0 | M43: =G43/E43 -> 1.1189391909991964 | N43: =I43/E43 -> 1.8907045271899274 | O43: 32 | P43: 2.4 | Q43: 70.2
A44: Barrett | B44: JDG | C44: ADC | D44: 1 | E44: 388.4 | F44: 8.4 | G44: 433.4 | H44: 4.7 | I44: 418.4 | J44: 2.9 | K44: 0.4 | L44: 0.2 | M44: =G44/E44 -> 1.115859938208033 | N44: =I44/E44 -> 1.0772399588053554 | O44: 8 | P44: 2.5 | Q44: 74.6
A45: XiaoAL | B45: SNG | C45: 上单 | D45: 2 | E45: 405.7 | F45: 9.4 | G45: 445.7 | H45: 22.2 | I45: 803.7 | J45: 26.7 | K45: 0.5 | L45: 0.1 | M45: =G45/E45 -> 1.0985950209514419 | N45: =I45/E45 -> 1.9810204584668476 | O45: 41 | P45: 3.5 | Q45: 70.2
A46: Lwx | B46: NB | C46: ADC | D46: 3 | E46: 443.7 | F46: 9.9 | G46: 683.9 | H46: 26.2 | I46: 468.6 | J46: 12.6 | K46: 0.2 | L46: 0.2 | M46: =G46/E46 -> 1.5413567725940951 | N46: =I46/E46 -> 1.0561189993238675 | O46: 36 | P46: 3 | Q46: 72.8
A47: mouse | B47: EDG | C47: 上单 | D47: 2 | E47: 397.1 | F47: 8.4 | G47: 424.1 | H47: 18 | I47: 714.9 | J47: 21.8 | K47: 0.5 | L47: 0.1 | M47: =G47/E47 -> 1.0679929488793756 | N47: =I47/E47 -> 1.8003021908839081 | O47: 39 | P47: 5.2 | Q47: 65.2
A48: Koro1 | B48: RNG | C48: 上单 | D48: 1 | E48: 395.1 | F48: 9.4 | G48: 421.4 | H48: 3.4 | I48: 653.4 | J48: 3.9 | K48: 0.5 | L48: 0.1 | M48: =G48/E48 -> 1.0665654264743101 | N48: =I48/E48 -> 1.65375854214123 | O48: 8 | P48: 3.6 | Q48: 60.1
A49: AmazingJ | B49: IM | C49: 上单 | D49: 3 | E49: 378.9 | F49: 8.8 | G49: 391.2 | H49: 19.4 | I49: 853.2 | J49: 27.8 | K49: 0.5 | L49: 0.1 | M49: =G49/E49 -> 1.0324623911322248 | N49: =I49/E49 -> 2.2517814726840859 | O49: 38 | P49: 2.2 | Q49: 65.7
A50: LetMe | B50: RNG | C50: 上单 | D50: 2 | E50: 384.3 | F50: 8.2 | G50: 394.9 | H50: 15.7 | I50: 670.3 | J50: 20 | K50: 0.5 | L50: 0.1 | M50: =G50/E50 -> 1.0275826177465521 | N50: =I50/E50 -> 1.7442102524069736 | O50: 40 | P50: 3.6 | Q50: 63.2
A51: HanXuan | C51: 打野 | D51: 0 | E51: 306.6 | F51: 2.9 | G51: 311.3 | H51: 0.3 | I51: 1014.9 | J51: 0.8 | K51: 0.7 | L51: 0.2 | M51: =G51/E51 -> 1.0153294194390083 | N51: =I51/E51 -> 3.310176125244618 | O51: 1 | P51: 3 | Q51: 85.7
A52: 957 | B52: WE | C52: 上单 | D52: 0 | E52: 379.8 | F52: 8.1 | G52: 384.2 | H52: 19.2 | I52: 717 | J52: 24 | K52: 0.5 | L52: 0.1 | M52: =G52/E52 -> 1.0115850447604002 | N52: =I52/E52 -> 1.8878357030015798 | O52: 53 | P52: 3.9 | Q52: 65.4
A53: Audi | B53: EDG | C53: 上单 | D53: 0 | E53: 414.8 | F53: 9.6 | G53: 417.2 | H53: 2.7 | I53: 577.6 | J53: 2.6 | K53: 0.5 | L53: 0.1 | M53: =G53/E53 -> 1.0057859209257474 | N53: =I53/E53 -> 1.3924783027965284 | O53: 5 | P53: 3.7 | Q53: 53.5
A54: Xiyang | B54: OMG | C54: 上单 | D54: 6 | E54: 385.1 | F54: 8.7 | G54: 361.1 | H54: 18.6 | I54: 709.6 | J54: 25.1 | K54: 0.5 | L54: 0.1 | M54: =G54/E54 -> 0.93767852505842642 | N54: =I54/E54 -> 1.8426382757725266 | O54: 43 | P54: 3.5 | Q54: 61.2
A55: Flawless | B55: IM | C55: 打野 | D55: 2 | E55: 312.8 | F55: 4 | G55: 290.9 | H55: 4.2 | I55: 778.5 | J55: 7.4 | K55: 1.1 | L55: 0.4 | M55: =G55/E55 -> 0.92998721227621473 | N55: =I55/E55 -> 2.4888107416879794 | O55: 11 | P55: 1.7 | Q55: 72.6
A56: Kabe | B56: JDG | C56: 上单 | D56: 1 | E56: 373.6 | F56: 8.3 | G56: 336.1 | H56: 17.7 | I56: 701.7 | J56: 24 | K56: 0.5 | L56: 0 | M56: =G56/E56 -> 0.89962526766595285 | N56: =I56/E56 -> 1.8782119914346895 | O56: 38 | P56: 3.1 | Q56: 67.1
A57: Ning | B57: iG | C57: 打野 | D57: 7 | E57: 350 | F57: 4.5 | G57: 309.4 | H57: 12.4 | I57: 784.2 | J57: 24 | K57: 0.9 | L57: 0.3 | M57: =G57/E57 -> 0.884 | N57: =I57/E57 -> 2.2405714285714287 | O57: 49 | P57: 4 | Q57: 72.3
A58: V | B58: NB | C58: 上单 | D58: 0 | E58: 373.9 | F58: 8.5 | G58: 330.3 | H58: 5.9 | I58: 711.1 | J58: 9 | K58: 0.4 | L58: 0.1 | M58: =G58/E58 -> 0.88339128109120091 | N58: =I58/E58 -> 1.901845413212089 | O58: 17 | P58: 2.3 | Q58: 57.7
A59: KidKid | B59: iG | C59: 打野 | D59: 1 | E59: 334 | F59: 3.9 | G59: 287.1 | H59: 1.6 | I59: 847.9 | J59: 3.6 | K59: 0.8 | L59: 0.3 | M59: =G59/E59 -> 0.85958083832335341 | N59: =I59/E59 -> 2.5386227544910178 | O59: 6 | P59: 3.4 | Q59: 65.8
A60: MLXG | B60: RNG | C60: 打野 | D60: 7 | E60: 328.9 | F60: 3.8 | G60: 274.5 | H60: 11.2 | I60: 861.3 | J60: 26.5 | K60: 0.8 | L60: 0.3 | M60: =G60/E60 -> 0.83460018242626943 | N60: =I60/E60 -> 2.6187290969899668 | O60: 41 | P60: 3.9 | Q60: 73.1
A61: LZ | B61: SNG | C61: 上单 | D61: 0 | E61: 345.4 | F61: 7.7 | G61: 283.5 | H61: 0.6 | I61: 698.5 | J61: 1 | K61: 0.5 | L61: 0.1 | M61: =G61/E61 -> 0.82078749276201513 | N61: =I61/E61 -> 2.0222929936305736 | O61: 2 | P61: 0.6 | Q61: 20
A62: Ben4 | B62: IM | C62: 打野 | D62: 0 | E62: 313.7 | F62: 5.2 | G62: 254.2 | H62: 1.1 | I62: 983.7 | J62: 2.9 | K62: 0.9 | L62: 0.4 | M62: =G62/E62 -> 0.8103283391775582 | N62: =I62/E62 -> 3.1357985336308576 | O62: 4 | P62: 1.5 | Q62: 55.5
A63: clearlove7 | B63: EDG | C63: 打野 | D63: 8 | E63: 351.1 | F63: 4 | G63: 279.4 | H63: 13 | I63: 783.4 | J63: 26.2 | K63: 1 | L63: 0.3 | M63: =G63/E63 -> 0.7957846767302762 | N63: =I63/E63 -> 2.2312731415551124 | O63: 42 | P63: 5.6 | Q63: 73.3
A64: Swift | B64: NB | C64: 打野 | D64: 4 | E64: 330.6 | F64: 4 | G64: 262.9 | H64: 11.9 | I64: 864.8 | J64: 27.8 | K64: 0.9 | L64: 0.3 | M64: =G64/E64 -> 0.79522081064730776 | N64: =I64/E64 -> 2.6158499697519657 | O64: 42 | P64: 3.1 | Q64: 72.4
A65: Jiekou | B65: OMG | C65: 打野 | D65: 2 | E65: 334.3 | F65: 4.3 | G65: 264.7 | H65: 9.6 | I65: 775.8 | J65: 19.4 | K65: 0.8 | L65: 0.4 | M65: =G65/E65 -> 0.79180376906969785 | N65: =I65/E65 -> 2.3206700568351777 | O65: 30 | P65: 2.6 | Q65: 59.3
A66: Avoidless | B66: SNG | C66: 打野 | D66: 0 | E66: 318 | F66: 3.7 | G66: 250.7 | H66: 2.6 | I66: 677.6 | J66: 4.8 | K66: 0.9 | L66: 0.3 | M66: =G66/E66 -> 0.78836477987421383 | N66: =I66/E66 -> 2.1308176100628931 | O66: 9 | P66: 2 | Q66: 70.8
A67: Happy | B67: NB | C67: ADC | D67: 0 | E67: 353.1 | F67: 9.3 | G67: 277 | H67: 0.2 | I67: 361.2 | J67: 0.2 | K67: 0.2 | L67: 0.3 | M67: =G67/E67 -> 0.78448031719059752 | N67: =I67/E67 -> 1.0229396771452846 | O67: 1 | P67: 1 | Q67: 40
A68: Sofm | B68: Snake | C68: 打野 | D68: 4 | E68: 334.2 | F68: 4.5 | G68: 260.4 | H68: 13 | I68: 826.2 | J68: 27.7 | K68: 1.3 | L68: 0.5 | M68: =G68/E68 -> 0.7791741472172351 | N68: =I68/E68 -> 2.4721723518850989 | O68: 42 | P68: 3.4 | Q68: 72.3
A69: Sks | B69: IM | C69: 打野 | D69: 4 | E69: 324.6 | F69: 4.3 | G69: 252.9 | H69: 7.7 | I69: 856 | J69: 17.1 | K69: 1 | L69: 0.3 | M69: =G69/E69 -> 0.77911275415896486 | N69: =I69/E69 -> 2.6370918052988293 | O69: 23 | P69: 2.7 | Q69: 72.5
A70: Karin | B70: DAN | C70: 打野 | D70: 3 | E70: 332.6 | F70: 4.1 | G70: 258.9 | H70: 11.8 | I70: 816.8 | J70: 25.3 | K70: 0.9 | L70: 0.4 | M70: =G70/E70 -> 0.77841250751653623 | N70: =I70/E70 -> 2.4558027660853874 | O70: 34 | P70: 3 | Q70: 76.3
A71: Y1han | B71: RNG | C71: 打野 | D71: 0 | E71: 346.1 | F71: 3.7 | G71: 261.4 | H71: 1.8 | I71: 789.4 | J71: 4.1 | K71: 1.1 | L71: 0.3 | M71: =G71/E71 -> 0.75527304247327354 | N71: =I71/E71 -> 2.2808436867957234 | O71: 7 | P71: 5.8 | Q71: 70.3
A72: Condi | B72: WE | C72: 打野 | D72: 11 | E72: 341.9 | F72: 4.3 | G72: 256 | H72: 12.8 | I72: 930.6 | J72: 31.2 | K72: 0.9 | L72: 0.3 | M72: =G72/E72 -> 0.74875694647557767 | N72: =I72/E72 -> 2.7218484937116116 | O72: 53 | P72: 4.2 | Q72: 75.4
A73: H4cker | B73: SNG | C73: 打野 | D73: 3 | E73: 332.3 | F73: 4.4 | G73: 232.8 | H73: 9.6 | I73: 818.7 | J73: 22.6 | K73: 1 | L73: 0.4 | M73: =G73/E73 -> 0.70057177249473368 | N73: =I73/E73 -> 2.4637375865182065 | O73: 34 | P73: 2.9 | Q73: 67.1
A74: TBQ | B74: ING | C74: 打野 | D74: 0 | E74: 286.5 | F74: 4.1 | G74: 199.9 | H74: 0.4 | I74: 862.2 | J74: 1.3 | K74: 0.8 | L74: 0.3 | M74: =G74/E74 -> 0.69773123909249568 | N74: =I74/E74 -> 3.0094240837696336 | O74: 2 | P74: 1 | Q74: 63.6
A75: Eimy | B75: LGD | C75: 打野 | D75: 8 | E75: 322.8 | F75: 3.8 | G75: 223.3 | H75: 11.1 | I75: 768 | J75: 27.4 | K75: 1 | L75: 0.4 | M75: =G75/E75 -> 0.6917596034696406 | N75: =I75/E75 -> 2.3791821561338291 | O75: 39 | P75: 3.2 | Q75: 72.2
A76: Megan | B76: iG | C76: 辅助 | D76: 9 | E76: 282.8 | F76: 1.1 | G76: 194.6 | H76: 8.8 | I76: 390.9 | J76: 13.6 | K76: 1.5 | L76: 0.3 | M76: =G76/E76 -> 0.68811881188118806 | N76: =I76/E76 -> 1.3822489391796322 | O76: 55 | P76: 4.4 | Q76: 73.7
A77: Cat | B77: DAN | C77: 辅助 | D77: 1 | E77: 272.6 | F77: 1.3 | G77: 185.6 | H77: 7.4 | I77: 516.2 | J77: 14.1 | K77: 1.5 | L77: 0.3 | M77: =G77/E77 -> 0.68085106382978711 | N77: =I77/E77 -> 1.8936170212765957 | O77: 31 | P77: 1.8 | Q77: 73.2
A78: World6 | B78: OMG | C78: 打野 | D78: 1 | E78: 311.8 | F78: 3.5 | G78: 211.8 | H78: 3.9 | I78: 854.2 | J78: 10.9 | K78: 0.9 | L78: 0.2 | M78: =G78/E78 -> 0.67928159076330985 | N78: =I78/E78 -> 2.7395766516998075 | O78: 16 | P78: 3 | Q78: 62.8
A79: FishBall | B79: DAN | C79: 打野 | D79: 0 | E79: 302.1 | F79: 3.8 | G79: 203.3 | H79: 1 | I79: 921.9 | J79: 3.3 | K79: 1 | L79: 0.3 | M79: =G79/E79 -> 0.67295597484276726 | N79: =I79/E79 -> 3.0516385302879838 | O79: 4 | P79: 1.8 | Q79: 65.8
A80: Pyl | B80: LGD | C80: 辅助 | D80: 1 | E80: 272.1 | F80: 1 | G80: 182.7 | H80: 9.1 | I80: 403.9 | J80: 14.4 | K80: 1.5 | L80: 0.4 | M80: =G80/E80 -> 0.671444321940463 | N80: =I80/E80 -> 1.4843807423741269 | O80: 39 | P80: 2.9 | Q80: 70.7
A81: Clid | B81: JDG | C81: 打野 | D81: 0 | E81: 326.2 | F81: 4.5 | G81: 217.1 | H81: 2.3 | I81: 680.8 | J81: 4.8 | K81: 0.9 | L81: 0.3 | M81: =G81/E81 -> 0.66554261189454322 | N81: =I81/E81 -> 2.0870631514408338 | O81: 8 | P81: 2.1 | Q81: 77.2
A82: Xinyi | B82: JDG | C82: 打野 | D82: 4 | E82: 315.7 | F82: 3.6 | G82: 205.1 | H82: 8.5 | I82: 824.1 | J82: 22.3 | K82: 1.1 | L82: 0.3 | M82: =G82/E82 -> 0.64966740576496673 | N82: =I82/E82 -> 2.6103896103896105 | O82: 30 | P82: 2.5 | Q82: 74.9
A83: Road | B83: IM | C83: 辅助 | D83: 0 | E83: 286.2 | F83: 1.7 | G83: 181.8 | H83: 6.3 | I83: 508.6 | J83: 11.7 | K83: 1.3 | L83: 0.4 | M83: =G83/E83 -> 0.6352201257861636 | N83: =I83/E83 -> 1.7770789657582111 | O83: 27 | P83: 2.5 | Q83: 77.6
A84: fage | B84: DAN | C84: 辅助 | D84: 0 | E84: 256.7 | F84: 1 | G84: 152.8 | H84: 1.6 | I84: 436.5 | J84: 3.1 | K84: 1.8 | L84: 0.3 | M84: =G84/E84 -> 0.59524737047136744 | N84: =I84/E84 -> 1.7004285157771719 | O84: 7 | P84: 2.3 | Q84: 70
A85: meiko | B85: EDG | C85: 辅助 | D85: 5 | E85: 294.9 | F85: 1.1 | G85: 175 | H85: 8.5 | I85: 430.8 | J85: 15.1 | K85: 1.5 | L85: 0.3 | M85: =G85/E85 -> 0.59342149881315709 | N85: =I85/E85 -> 1.4608341810783319 | O85: 44 | P85: 4.8 | Q85: 75.6
A86: Fireloli | B86: EDG | C86: 打野 | D86: 0 | E86: 282.6 | F86: 3.5 | G86: 166.8 | H86: 0.3 | I86: 808.9 | J86: 1.3 | K86: 1.1 | L86: 0.2 | M86: =G86/E86 -> 0.59023354564755837 | N86: =I86/E86 -> 2.8623496107572537 | O86: 2 | P86: 0.8 | Q86: 54.5
A87: Ben | B87: WE | C87: 辅助 | D87: 2 | E87: 273.2 | F87: 0.9 | G87: 161 | H87: 7.6 | I87: 397.5 | J87: 12.6 | K87: 1.4 | L87: 0.3 | M87: =G87/E87 -> 0.58931185944363107 | N87: =I87/E87 -> 1.45497803806735 | O87: 50 | P87: 3.6 | Q87: 73.6
A88: Ming | B88: RNG | C88: 辅助 | D88: 7 | E88: 269.8 | F88: 1 | G88: 149.2 | H88: 7.1 | I88: 431.2 | J88: 15.5 | K88: 1.6 | L88: 0.3 | M88: =G88/E88 -> 0.55300222386953291 | N88: =I88/E88 -> 1.59822090437361 | O88: 48 | P88: 4.1 | Q88: 72.6
A89: LvMao | B89: JDG | C89: 辅助 | D89: 2 | E89: 259.9 | F89: 1.1 | G89: 143.7 | H89: 7.2 | I89: 421.6 | J89: 13.7 | K89: 1.3 | L89: 0.2 | M89: =G89/E89 -> 0.55290496344747986 | N89: =I89/E89 -> 1.6221623701423626 | O89: 36 | P89: 2.8 | Q89: 72.4
A90: Five | B90: OMG | C90: 辅助 | D90: 3 | E90: 290.6 | F90: 0.7 | G90: 155.8 | H90: 8 | I90: 375.8 | J90: 13.2 | K90: 1.3 | L90: 0.3 | M90: =G90/E90 -> 0.53613214039917412 | N90: =I90/E90 -> 1.2931865106675842 | O90: 43 | P90: 3.6 | Q90: 75.1
A91: Zero | B91: WE | C91: 辅助 | D91: 0 | E91: 280.4 | F91: 0.8 | G91: 148 | H91: 0.4 | I91: 431.2 | J91: 0.8 | K91: 1.3 | L91: 0.2 | M91: =G91/E91 -> 0.52781740370898722 | N91: =I91/E91 -> 1.5378031383737518 | O91: 3 | P91: 3.1 | Q91: 73
A92: Hudie | B92: Snake | C92: 辅助 | D92: 2 | E92: 272.7 | F92: 0.9 | G92: 137.6 | H92: 4.5 | I92: 415.8 | J92: 9.2 | K92: 1.5 | L92: 0.3 | M92: =G92/E92 -> 0.50458379171250456 | N92: =I92/E92 -> 1.5247524752475248 | O92: 28 | P92: 4.4 | Q92: 74.2
A93: Mor | B93: NB | C93: 辅助 | D93: 3 | E93: 289.8 | F93: 1 | G93: 143.2 | H93: 2.2 | I93: 408 | J93: 4.5 | K93: 1.5 | L93: 0.3 | M93: =G93/E93 -> 0.49413388543823322 | N93: =I93/E93 -> 1.4078674948240164 | O93: 14 | P93: 6.2 | Q93: 80
A94: Pinus | B94: NB | C94: 辅助 | D94: 4 | E94: 271.8 | F94: 0.7 | G94: 129 | H94: 4.2 | I94: 362.3 | J94: 8.4 | K94: 1.4 | L94: 0.3 | M94: =G94/E94 -> 0.47461368653421632 | N94: =I94/E94 -> 1.3329654157468727 | O94: 31 | P94: 3.8 | Q94: 75.9
A95: Cloud | B95: JDG | C95: 辅助 | D95: 0 | E95: 244.7 | F95: 1.7 | G95: 114.8 | H95: 0.2 | I95: 335.1 | J95: 0.5 | K95: 1.4 | L95: 0.5 | M95: =G95/E95 -> 0.46914589293011855 | N95: =I95/E95 -> 1.3694319574989784 | O95: 2 | P95: 1.3 | Q95: 55
A96: YOON | B96: SNG | C96: 辅助 | D96: 2 | E96: 263.5 | F96: 1.1 | G96: 123.2 | H96: 5.7 | I96: 357.7 | J96: 11.1 | K96: 1.5 | L96: 0.2 | M96: =G96/E96 -> 0.46755218216318789 | N96: =I96/E96 -> 1.3574952561669829 | O96: 38 | P96: 3.7 | Q96: 70.6
A97: Starlight | B97: IM | C97: 辅助 | D97: 0 | E97: 255.1 | F97: 1.2 | G97: 115.8 | H97: 1.6 | I97: 502 | J97: 4.8 | K97: 1.5 | L97: 0.2 | M97: =G97/E97 -> 0.45393963151705213 | N97: =I97/E97 -> 1.9678557428459429 | O97: 11 | P97: 1.6 | Q97: 64.2
A98: Brain | B98: SNG | C98: 辅助 | D98: 0 | E98: 305.8 | F98: 0.9 | G98: 125.3 | H98: 0.7 | I98: 378.3 | J98: 1.4 | K98: 1.3 | L98: 0.3 | M98: =G98/E98 -> 0.4097449313276651 | N98: =I98/E98 -> 1.2370830608240679 | O98: 5 | P98: 4.3 | Q98: 75.4