A1: 选手名字 | B1: 所属队伍 | C1: 位置 | D1: Mvp | E1: 分均经济 | F1: 分均补刀 | G1: 分均伤害 | H1: 伤害占比 | I1: 分均承伤 | J1: 承伤占比 | K1: 分均放眼 | L1: 分均拆眼 | M1: 伤害/经济 | N1: 承伤/经济 | O1: 出场次数 | P1: KDA | Q1: 场均参团率
A2: ABSOLUT | B2: oNe | C2: ADC | D2: 2 | E2: 416.2 | F2: 9 | G2: 556.1 | H2: 32.8 | I2: 381.5 | J2: 12.7 | K2: 0.4 | L2: 0.2 | M2: =G2/E2 -> 1.3361364728495917 | N2: =I2/E2 -> 0.91662662181643439 | O2: 9 | P2: 3.4 | Q2: 71.2
A3: Rekkles | B3: FNC | C3: ADC | D3: 1 | E3: 472.5 | F3: 11.1 | G3: 631.5 | H3: 32.1 | I3: 348.8 | J3: 13 | K3: 0.3 | L3: 0.3 | M3: =G3/E3 -> 1.3365079365079364 | N3: =I3/E3 -> 0.73820105820105819 | O3: 19 | P3: 5.1 | Q3: 69.6
A4: Zven | B4: G2 | C4: ADC | D4: 1 | E4: 449.6 | F4: 10.4 | G4: 913.5 | H4: 41.7 | I4: 423.2 | J4: 12.9 | K4: 0.3 | L4: 0.4 | M4: =G4/E4 -> 2.0318060498220638 | N4: =I4/E4 -> 0.9412811387900355 | O4: 6 | P4: 3.8 | Q4: 67.8
A5: Bang | B5: SKT | C5: ADC | D5: 3 | E5: 422.8 | F5: 9.6 | G5: 601.6 | H5: 34 | I5: 363.6 | J5: 13.2 | K5: 0.4 | L5: 0.2 | M5: =G5/E5 -> 1.4228949858088931 | N5: =I5/E5 -> 0.85998107852412486 | O5: 19 | P5: 4.5 | Q5: 69.4
A6: Ruler | B6: SSG | C6: ADC | D6: 4 | E6: 458 | F6: 10.3 | G6: 706.4 | H6: 34.6 | I6: 413.9 | J6: 16.1 | K6: 0.5 | L6: 0.4 | M6: =G6/E6 -> 1.5423580786026201 | N6: =I6/E6 -> 0.90371179039301308 | O6: 16 | P6: 7.3 | Q6: 77.6
A7: IBoy | B7: EDG | C7: ADC | D7: 2 | E7: 461.5 | F7: 10.2 | G7: 851.5 | H7: 40.2 | I7: 439.4 | J7: 15.4 | K7: 0.4 | L7: 0.3 | M7: =G7/E7 -> 1.8450704225352113 | N7: =I7/E7 -> 0.95211267605633798 | O7: 6 | P7: 5.5 | Q7: 74.3
A8: WhiteLotus | B8: Lyon | C8: ADC | D8: 1 | E8: 435.7 | F8: 10 | G8: 793.8 | H8: 37.4 | I8: 411.8 | J8: 15 | K8: 0.4 | L8: 0.3 | M8: =G8/E8 -> 1.8218957998622904 | N8: =I8/E8 -> 0.94514574248336014 | O8: 7 | P8: 6.7 | Q8: 77.1
A9: Phantiks | B9: DW | C9: 中单 | D9: 1 | E9: 432 | F9: 10.1 | G9: 717.8 | H9: 36.1 | I9: 688.6 | J9: 23.7 | K9: 0.3 | L9: 0.2 | M9: =G9/E9 -> 1.6615740740740739 | N9: =I9/E9 -> 1.5939814814814814 | O9: 5 | P9: 1.9 | Q9: 58.9
A10: Unified | B10: HKA | C10: ADC | D10: 1 | E10: 446.2 | F10: 10.3 | G10: 689.8 | H10: 35.9 | I10: 378.2 | J10: 13.7 | K10: 0.3 | L10: 0.3 | M10: =G10/E10 -> 1.5459435230838188 | N10: =I10/E10 -> 0.8476019722097714 | O10: 8 | P10: 4.1 | Q10: 83.7
A11: Cody sun | B11: IMT | C11: ADC | D11: 1 | E11: 425 | F11: 9.9 | G11: 627.7 | H11: 31.8 | I11: 385.9 | J11: 14.2 | K11: 0.3 | L11: 0.2 | M11: =G11/E11 -> 1.4769411764705884 | N11: =I11/E11 -> 0.908 | O11: 7 | P11: 2.7 | Q11: 66.1
A12: Hans sama | B12: MSF | C12: ADC | D12: 4 | E12: 435.7 | F12: 9.8 | G12: 704.2 | H12: 38.2 | I12: 412.3 | J12: 16 | K12: 0.4 | L12: 0.3 | M12: =G12/E12 -> 1.6162497131053479 | N12: =I12/E12 -> 0.94629332109249487 | O12: 12 | P12: 4.2 | Q12: 78
A13: Maple | B13: FW | C13: 中单 | D13: 0 | E13: 402.6 | F13: 9.8 | G13: 641.6 | H13: 33.9 | I13: 515.7 | J13: 16.6 | K13: 0.5 | L13: 0.1 | M13: =G13/E13 -> 1.5936413313462494 | N13: =I13/E13 -> 1.2809239940387482 | O13: 6 | P13: 3.3 | Q13: 76.7
A14: Caps | B14: FNC | C14: 中单 | D14: 3 | E14: 406.2 | F14: 8.7 | G14: 644 | H14: 32.8 | I14: 512 | J14: 19.1 | K14: 0.4 | L14: 0.1 | M14: =G14/E14 -> 1.5854258985721319 | N14: =I14/E14 -> 1.2604628261939932 | O14: 19 | P14: 3.8 | Q14: 72.6
A15: Uzi | B15: RNG | C15: ADC | D15: 4 | E15: 476 | F15: 10.9 | G15: 780.7 | H15: 40.1 | I15: 479.8 | J15: 17.5 | K15: 0.4 | L15: 0.3 | M15: =G15/E15 -> 1.6401260504201682 | N15: =I15/E15 -> 1.0079831932773109 | O15: 15 | P15: 8.5 | Q15: 75.3
A16: Noway | B16: GAM | C16: ADC | D16: 1 | E16: 433.4 | F16: 9.7 | G16: 597.3 | H16: 30.9 | I16: 384.2 | J16: 13.3 | K16: 0.4 | L16: 0.2 | M16: =G16/E16 -> 1.3781725888324872 | N16: =I16/E16 -> 0.88647900323027229 | O16: 7 | P16: 5.1 | Q16: 69.8
A17: BigKoro | B17: YG | C17: ADC | D17: 0 | E17: 423.6 | F17: 9.7 | G17: 466.6 | H17: 27.5 | I17: 378.4 | J17: 13.9 | K17: 0.4 | L17: 0.2 | M17: =G17/E17 -> 1.1015108593012275 | N17: =I17/E17 -> 0.8932955618508025 | O17: 7 | P17: 3.8 | Q17: 66.6
A18: Fix | B18: KLG | C18: ADC | D18: 0 | E18: 409.7 | F18: 9.4 | G18: 628.3 | H18: 38.1 | I18: 450.8 | J18: 15.8 | K18: 0.3 | L18: 0.1 | M18: =G18/E18 -> 1.5335611422992432 | N18: =I18/E18 -> 1.1003173053453748 | O18: 4 | P18: 1.7 | Q18: 72.7
A19: Betty | B19: FW | C19: ADC | D19: 0 | E19: 403.8 | F19: 9.6 | G19: 630.6 | H19: 33.3 | I19: 418 | J19: 13.5 | K19: 0.3 | L19: 0.4 | M19: =G19/E19 -> 1.5616641901931649 | N19: =I19/E19 -> 1.035165923724616 | O19: 6 | P19: 3.2 | Q19: 74.4
A20: Optimus | B20: GAM | C20: 中单 | D20: 1 | E20: 379.7 | F20: 8.6 | G20: 558.3 | H20: 28.9 | I20: 413.7 | J20: 14.3 | K20: 0.6 | L20: 0.2 | M20: =G20/E20 -> 1.4703713457993153 | N20: =I20/E20 -> 1.0895443771398472 | O20: 7 | P20: 2 | Q20: 54.7
A21: Seiya | B21: Lyon | C21: 中单 | D21: 0 | E21: 382.4 | F21: 8.6 | G21: 552.7 | H21: 26 | I21: 322.5 | J21: 11.7 | K21: 0.5 | L21: 0.2 | M21: =G21/E21 -> 1.445345188284519 | N21: =I21/E21 -> 0.84335774058577406 | O21: 7 | P21: 8.6 | Q21: 74.2
A22: scout | B22: EDG | C22: 中单 | D22: 0 | E22: 413.1 | F22: 8.8 | G22: 595.8 | H22: 28.1 | I22: 560.3 | J22: 19.7 | K22: 0.3 | L22: 0.3 | M22: =G22/E22 -> 1.4422657952069715 | N22: =I22/E22 -> 1.3563301863955457 | O22: 6 | P22: 4.3 | Q22: 75.6
A23: Westdoor | B23: AHQ | C23: 中单 | D23: 1 | E23: 379.1 | F23: 8.6 | G23: 545.7 | H23: 22.4 | I23: 460.8 | J23: 12 | K23: 0.2 | L23: 0.2 | M23: =G23/E23 -> 1.4394618834080717 | N23: =I23/E23 -> 1.2155104194144024 | O23: 4 | P23: 3.5 | Q23: 75
A24: Pobelter | B24: IMT | C24: 中单 | D24: 0 | E24: 382.4 | F24: 8.8 | G24: 547.6 | H24: 27.8 | I24: 408.9 | J24: 15 | K24: 0.5 | L24: 0.2 | M24: =G24/E24 -> 1.4320083682008369 | N24: =I24/E24 -> 1.0692991631799162 | O24: 7 | P24: 2.4 | Q24: 69.4
A25: AN | B25: AHQ | C25: ADC | D25: 0 | E25: 405.7 | F25: 9.6 | G25: 580.3 | H25: 34.2 | I25: 338.3 | J25: 12.6 | K25: 0.4 | L25: 0.3 | M25: =G25/E25 -> 1.430367266453044 | N25: =I25/E25 -> 0.83386738969682039 | O25: 6 | P25: 1.9 | Q25: 73.5
A26: Bjergsen | B26: TSM | C26: 中单 | D26: 1 | E26: 401.4 | F26: 9.4 | G26: 574.1 | H26: 27.7 | I26: 405.2 | J26: 13.7 | K26: 0.3 | L26: 0.1 | M26: =G26/E26 -> 1.4302441454907824 | N26: =I26/E26 -> 1.0094668659691082 | O26: 7 | P26: 4.2 | Q26: 85.7
A27: Blasting | B27: GMB | C27: ADC | D27: 0 | E27: 358.6 | F27: 8.4 | G27: 511.6 | H27: 32.4 | I27: 507.7 | J27: 15.5 | K27: 0.4 | L27: 0.2 | M27: =G27/E27 -> 1.4266592303402119 | N27: =I27/E27 -> 1.4157836029001671 | O27: 4 | P27: 0.7 | Q27: 63.6
A28: Padden | B28: FB | C28: ADC | D28: 3 | E28: 444.2 | F28: 9.8 | G28: 747.6 | H28: 36.7 | I28: 377.4 | J28: 13 | K28: 0.2 | L28: 0.2 | M28: =G28/E28 -> 1.6830256641152634 | N28: =I28/E28 -> 0.8496172895092301 | O28: 15 | P28: 4.1 | Q28: 78.9
A29: xiye | B29: WE | C29: 中单 | D29: 2 | E29: 429.3 | F29: 9.2 | G29: 601.3 | H29: 28.7 | I29: 475.3 | J29: 16.8 | K29: 0.3 | L29: 0.2 | M29: =G29/E29 -> 1.4006522245515955 | N29: =I29/E29 -> 1.1071511763335662 | O29: 22 | P29: 5.9 | Q29: 69.8
A30: PraY | B30: LZ | C30: ADC | D30: 2 | E30: 450.7 | F30: 9.9 | G30: 764.1 | H30: 36.6 | I30: 425 | J30: 15.3 | K30: 0.4 | L30: 0.3 | M30: =G30/E30 -> 1.6953627690259596 | N30: =I30/E30 -> 0.94297759041491014 | O30: 9 | P30: 4.9 | Q30: 73.6
A31: Frozen | B31: FB | C31: 中单 | D31: 0 | E31: 408.9 | F31: 9.3 | G31: 555.8 | H31: 27.3 | I31: 410.9 | J31: 14.1 | K31: 0.4 | L31: 0.1 | M31: =G31/E31 -> 1.359256541941795 | N31: =I31/E31 -> 1.0048911714355588 | O31: 15 | P31: 2.9 | Q31: 69.7
A32: M1ssion | B32: HKA | C32: 中单 | D32: 0 | E32: 388.2 | F32: 9 | G32: 521.7 | H32: 27.2 | I32: 433.3 | J32: 15.7 | K32: 0.3 | L32: 0.2 | M32: =G32/E32 -> 1.3438948995363216 | N32: =I32/E32 -> 1.1161772282328697 | O32: 8 | P32: 2.3 | Q32: 59.4
A33: Jensen | B33: C9 | C33: 中单 | D33: 1 | E33: 431.8 | F33: 9.5 | G33: 580.2 | H33: 26 | I33: 407.6 | J33: 14.7 | K33: 0.4 | L33: 0.1 | M33: =G33/E33 -> 1.3436776285317278 | N33: =I33/E33 -> 0.94395553496989348 | O33: 18 | P33: 5.1 | Q33: 80.8
A34: Hauntzer | B34: TSM | C34: 上单 | D34: 0 | E34: 387.2 | F34: 8.7 | G34: 518.4 | H34: 25 | I34: 825 | J34: 28 | K34: 0.5 | L34: 0.1 | M34: =G34/E34 -> 1.3388429752066116 | N34: =I34/E34 -> 2.1306818181818183 | O34: 7 | P34: 2.1 | Q34: 75.5
A35: MyStic | B35: WE | C35: ADC | D35: 4 | E35: 448.7 | F35: 9.5 | G35: 772.9 | H35: 36.9 | I35: 430.7 | J35: 15.3 | K35: 0.3 | L35: 0.3 | M35: =G35/E35 -> 1.7225317584131936 | N35: =I35/E35 -> 0.95988410965010029 | O35: 22 | P35: 4.1 | Q35: 69.4
A36: Doublelift | B36: TSM | C36: ADC | D36: 1 | E36: 404.6 | F36: 9.1 | G36: 658.7 | H36: 31.8 | I36: 393.8 | J36: 13.3 | K36: 0.4 | L36: 0.3 | M36: =G36/E36 -> 1.6280276816608996 | N36: =I36/E36 -> 0.97330696984676224 | O36: 7 | P36: 1.8 | Q36: 71.4
A37: Perkz | B37: G2 | C37: 中单 | D37: 0 | E37: 414.3 | F37: 9.9 | G37: 552.7 | H37: 25.2 | I37: 517.3 | J37: 15.8 | K37: 0.4 | L37: 0.2 | M37: =G37/E37 -> 1.3340574462949555 | N37: =I37/E37 -> 1.2486121168235578 | O37: 6 | P37: 5.7 | Q37: 71.4
A38: Naul | B38: YG | C38: 中单 | D38: 1 | E38: 406.6 | F38: 9 | G38: 537.4 | H38: 31.6 | I38: 483.1 | J38: 17.7 | K38: 0.4 | L38: 0.1 | M38: =G38/E38 -> 1.321692080668962 | N38: =I38/E38 -> 1.1881455976389572 | O38: 7 | P38: 3.2 | Q38: 80.7
A39: PowerOfEvil | B39: MSF | C39: 中单 | D39: 0 | E39: 390.9 | F39: 8.8 | G39: 513 | H39: 27.8 | I39: 354.9 | J39: 13.8 | K39: 0.4 | L39: 0.2 | M39: =G39/E39 -> 1.3123561013046816 | N39: =I39/E39 -> 0.9079048349961627 | O39: 12 | P39: 4.9 | Q39: 73.6
A40: Bdd | B40: LZ | C40: 中单 | D40: 1 | E40: 427.8 | F40: 9.6 | G40: 542.6 | H40: 26 | I40: 306.9 | J40: 11 | K40: 0.5 | L40: 0 | M40: =G40/E40 -> 1.2683496961196821 | N40: =I40/E40 -> 0.71739130434782605 | O40: 9 | P40: 7.1 | Q40: 75.4
A41: Ramune | B41: RPG | C41: 中单 | D41: 0 | E41: 346.4 | F41: 8.6 | G41: 438.9 | H41: 34.7 | I41: 437.7 | J41: 15.4 | K41: 0.3 | L41: 0.1 | M41: =G41/E41 -> 1.2670323325635104 | N41: =I41/E41 -> 1.2635681293302541 | O41: 4 | P41: 1.7 | Q41: 93.3
A42: Jirall | B42: Lyon | C42: 上单 | D42: 0 | E42: 329.8 | F42: 6.7 | G42: 413.1 | H42: 19.4 | I42: 777.2 | J42: 28.3 | K42: 0.5 | L42: 0.1 | M42: =G42/E42 -> 1.2525773195876289 | N42: =I42/E42 -> 2.356579745300182 | O42: 7 | P42: 2.7 | Q42: 70
A43: Marf | B43: oNe | C43: 中单 | D43: 0 | E43: 371.5 | F43: 7.5 | G43: 449.1 | H43: 14.9 | I43: 506.6 | J43: 9.5 | K43: 0.3 | L43: 0.1 | M43: =G43/E43 -> 1.2088829071332436 | N43: =I43/E43 -> 1.3636608344549126 | O43: 5 | P43: 2.7 | Q43: 69.2
A44: Crown | B44: SSG | C44: 中单 | D44: 1 | E44: 418.7 | F44: 9.3 | G44: 500.2 | H44: 24.5 | I44: 341.6 | J44: 13.2 | K44: 0.6 | L44: 0.2 | M44: =G44/E44 -> 1.1946501074755194 | N44: =I44/E44 -> 0.81585860998328164 | O44: 16 | P44: 5 | Q44: 75.1
A45: Expect | B45: G2 | C45: 上单 | D45: 0 | E45: 369.5 | F45: 8.2 | G45: 440.6 | H45: 20.1 | I45: 1062.2 | J45: 32.5 | K45: 0.5 | L45: 0.1 | M45: =G45/E45 -> 1.1924221921515563 | N45: =I45/E45 -> 2.8746955345060896 | O45: 6 | P45: 3.6 | Q45: 64.2
A46: Haru | B46: SSG | C46: 打野 | D46: 1 | E46: 347 | F46: 4.6 | G46: 402.8 | H46: 1.7 | I46: 485.4 | J46: 1.6 | K46: 0.9 | L46: 0.3 | M46: =G46/E46 -> 1.1608069164265129 | N46: =I46/E46 -> 1.3988472622478385 | O46: 1 | P46: 9 | Q46: 100
A47: CuVee | B47: SSG | C47: 上单 | D47: 0 | E47: 413.5 | F47: 9.2 | G47: 469 | H47: 22.9 | I47: 738.5 | J47: 28.7 | K47: 0.6 | L47: 0.1 | M47: =G47/E47 -> 1.1342200725513907 | N47: =I47/E47 -> 1.7859733978234582 | O47: 16 | P47: 4.6 | Q47: 72.6
A48: xiaohu | B48: RNG | C48: 中单 | D48: 1 | E48: 416 | F48: 9.5 | G48: 471.6 | H48: 24.2 | I48: 469.8 | J48: 17.1 | K48: 0.3 | L48: 0.3 | M48: =G48/E48 -> 1.1336538461538461 | N48: =I48/E48 -> 1.1293269230769232 | O48: 15 | P48: 7.5 | Q48: 76.5
A49: Flame | B49: IMT | C49: 上单 | D49: 1 | E49: 359.5 | F49: 8.1 | G49: 407.3 | H49: 20.6 | I49: 866.1 | J49: 31.9 | K49: 0.4 | L49: 0.1 | M49: =G49/E49 -> 1.1329624478442282 | N49: =I49/E49 -> 2.4091794158553546 | O49: 7 | P49: 2.5 | Q49: 74.5
A50: K1ng | B50: DW | C50: ADC | D50: 0 | E50: 394.7 | F50: 8.9 | G50: 446.6 | H50: 22.5 | I50: 421.1 | J50: 14.5 | K50: 0.4 | L50: 0.2 | M50: =G50/E50 -> 1.1314922726121106 | N50: =I50/E50 -> 1.0668862427159869 | O50: 5 | P50: 2.8 | Q50: 75
A51: Chippys | B51: DW | C51: 上单 | D51: 0 | E51: 381.2 | F51: 8.5 | G51: 424.8 | H51: 21.4 | I51: 611.7 | J51: 21 | K51: 0.4 | L51: 0 | M51: =G51/E51 -> 1.1143756558237146 | N51: =I51/E51 -> 1.604669464847849 | O51: 5 | P51: 2.1 | Q51: 60.7
A52: Thaldrin | B52: FB | C52: 上单 | D52: 1 | E52: 355.6 | F52: 7.8 | G52: 392 | H52: 19.2 | I52: 906 | J52: 31.2 | K52: 0.5 | L52: 0.1 | M52: =G52/E52 -> 1.1023622047244095 | N52: =I52/E52 -> 2.5478065241844767 | O52: 15 | P52: 2.5 | Q52: 69.7
A53: Sneaky | B53: C9 | C53: ADC | D53: 2 | E53: 438.1 | F53: 9.5 | G53: 791.8 | H53: 35.4 | I53: 409.5 | J53: 14.8 | K53: 0.3 | L53: 0.4 | M53: =G53/E53 -> 1.8073499201095637 | N53: =I53/E53 -> 0.93471810089020768 | O53: 18 | P53: 5.2 | Q53: 68.6
A54: Huni | B54: SKT | C54: 上单 | D54: 2 | E54: 416.4 | F54: 9.5 | G54: 453.3 | H54: 25.6 | I54: 847.7 | J54: 30.8 | K54: 0.4 | L54: 0.1 | M54: =G54/E54 -> 1.0886167146974064 | N54: =I54/E54 -> 2.0357829010566766 | O54: 19 | P54: 2.8 | Q54: 68.2
A55: Contractz | B55: C9 | C55: 打野 | D55: 8 | E55: 354.7 | F55: 4.7 | G55: 385.8 | H55: 17.2 | I55: 905.8 | J55: 32.8 | K55: 0.8 | L55: 0.3 | M55: =G55/E55 -> 1.0876797293487455 | N55: =I55/E55 -> 2.5537073583309837 | O55: 18 | P55: 4.4 | Q55: 80.3
A56: Riris | B56: HKA | C56: 上单 | D56: 0 | E56: 370.4 | F56: 8.6 | G56: 399.6 | H56: 20.8 | I56: 758.1 | J56: 27.5 | K56: 0.5 | L56: 0.1 | M56: =G56/E56 -> 1.0788336933045357 | N56: =I56/E56 -> 2.0467062634989204 | O56: 8 | P56: 2.1 | Q56: 63.5
A57: Ziv | B57: AHQ | C57: 上单 | D57: 0 | E57: 344.7 | F57: 8 | G57: 370.3 | H57: 21.8 | I57: 794.4 | J57: 29.7 | K57: 0.5 | L57: 0.1 | M57: =G57/E57 -> 1.074267478967218 | N57: =I57/E57 -> 2.3046127067014797 | O57: 6 | P57: 2.6 | Q57: 76.4
A58: Khan | B58: LZ | C58: 上单 | D58: 0 | E58: 411.6 | F58: 9.1 | G58: 437.7 | H58: 17.5 | I58: 775.6 | J58: 23.4 | K58: 0.6 | L58: 0.1 | M58: =G58/E58 -> 1.0634110787172011 | N58: =I58/E58 -> 1.8843537414965985 | O58: 8 | P58: 4.4 | Q58: 67.3
A59: 957 | B59: WE | C59: 上单 | D59: 0 | E59: 370 | F59: 7.4 | G59: 390.8 | H59: 18.6 | I59: 791.4 | J59: 28.1 | K59: 0.5 | L59: 0.1 | M59: =G59/E59 -> 1.0562162162162163 | N59: =I59/E59 -> 2.1389189189189191 | O59: 22 | P59: 5.2 | Q59: 64.5
A60: Faker | B60: SKT | C60: 中单 | D60: 1 | E60: 411.9 | F60: 9.5 | G60: 427.8 | H60: 24.2 | I60: 467.8 | J60: 17 | K60: 0.5 | L60: 0.2 | M60: =G60/E60 -> 1.0386016023306628 | N60: =I60/E60 -> 1.1357125515901918 | O60: 19 | P60: 3.7 | Q60: 78.8
A61: mouse | B61: EDG | C61: 上单 | D61: 0 | E61: 357 | F61: 7.4 | G61: 369.6 | H61: 17.4 | I61: 729.2 | J61: 25.6 | K61: 0.5 | L61: 0.1 | M61: =G61/E61 -> 1.0352941176470589 | N61: =I61/E61 -> 2.0425770308123252 | O61: 6 | P61: 5.1 | Q61: 62.1
A62: Impact | B62: C9 | C62: 上单 | D62: 0 | E62: 372.3 | F62: 7.8 | G62: 385 | H62: 17.2 | I62: 783.4 | J62: 28.4 | K62: 0.5 | L62: 0.1 | M62: =G62/E62 -> 1.0341122750470051 | N62: =I62/E62 -> 2.1042170292774642 | O62: 18 | P62: 4 | Q62: 68.6
A63: NhocTy | B63: YG | C63: 上单 | D63: 0 | E63: 381.8 | F63: 8.7 | G63: 385.4 | H63: 14 | I63: 852.1 | J63: 19.3 | K63: 0.5 | L63: 0 | M63: =G63/E63 -> 1.0094290204295442 | N63: =I63/E63 -> 2.2317967522262965 | O63: 5 | P63: 1.8 | Q63: 57.1
A64: SoaZ | B64: FNC | C64: 上单 | D64: 2 | E64: 358 | F64: 7.2 | G64: 361.2 | H64: 18.4 | I64: 827.4 | J64: 30.9 | K64: 0.5 | L64: 0.1 | M64: =G64/E64 -> 1.0089385474860335 | N64: =I64/E64 -> 2.3111731843575418 | O64: 19 | P64: 2.4 | Q64: 59.2
A65: MANTARRAYA | B65: KLG | C65: 上单 | D65: 1 | E65: 352 | F65: 8.5 | G65: 354.6 | H65: 21.5 | I65: 745.2 | J65: 26.1 | K65: 0.5 | L65: 0 | M65: =G65/E65 -> 1.0073863636363638 | N65: =I65/E65 -> 2.1170454545454547 | O65: 4 | P65: 1.8 | Q65: 59
A66: Plugo | B66: KLG | C66: 中单 | D66: 0 | E66: 339.9 | F66: 7.7 | G66: 340.2 | H66: 20.6 | I66: 428 | J66: 15 | K66: 0.6 | L66: 0.1 | M66: =G66/E66 -> 1.0008826125330981 | N66: =I66/E66 -> 1.259193880553104 | O66: 4 | P66: 1.8 | Q66: 81.8
A67: PVPStejos | B67: GMB | C67: 上单 | D67: 0 | E67: 331.5 | F67: 7.6 | G67: 329.2 | H67: 20.8 | I67: 813.7 | J67: 25 | K67: 0.4 | L67: 0.1 | M67: =G67/E67 -> 0.99306184012066356 | N67: =I67/E67 -> 2.4546003016591253 | O67: 4 | P67: 0.4 | Q67: 45.4
A68: BRUCER | B68: oNe | C68: 中单 | D68: 0 | E68: 351.5 | F68: 7.8 | G68: 345.3 | H68: 8.9 | I68: 508 | J68: 7.4 | K68: 0.4 | L68: 0.2 | M68: =G68/E68 -> 0.98236130867709814 | N68: =I68/E68 -> 1.4452347083926032 | O68: 4 | P68: 1.6 | Q68: 65.7
A69: Kira | B69: GMB | C69: 中单 | D69: 0 | E69: 328.2 | F69: 7.7 | G69: 319.7 | H69: 20.2 | I69: 571.8 | J69: 17.5 | K69: 0.5 | L69: 0.2 | M69: =G69/E69 -> 0.97410115783059115 | N69: =I69/E69 -> 1.7422303473491771 | O69: 4 | P69: 0.4 | Q69: 36.3
A70: LetMe | B70: RNG | C70: 上单 | D70: 1 | E70: 360.3 | F70: 7.7 | G70: 341.2 | H70: 17.5 | I70: 764.9 | J70: 27.9 | K70: 0.5 | L70: 0 | M70: =G70/E70 -> 0.94698862059394939 | N70: =I70/E70 -> 2.1229530946433526 | O70: 15 | P70: 3.7 | Q70: 62
A71: VVVERT | B71: oNe | C71: 上单 | D71: 0 | E71: 349.8 | F71: 7.4 | G71: 330.5 | H71: 19.5 | I71: 758.4 | J71: 25.3 | K71: 0.4 | L71: 0.1 | M71: =G71/E71 -> 0.94482561463693537 | N71: =I71/E71 -> 2.1680960548885078 | O71: 9 | P71: 2.1 | Q71: 56.3
A72: Rascal | B72: LZ | C72: 上单 | D72: 0 | E72: 434.1 | F72: 9.5 | G72: 401.9 | H72: 3.1 | I72: 865.9 | J72: 5 | K72: 0.6 | L72: 0.1 | M72: =G72/E72 -> 0.92582354296245095 | N72: =I72/E72 -> 1.994701681640175 | O72: 1 | P72: 8 | Q72: 100
A73: Levi | B73: GAM | C73: 打野 | D73: 0 | E73: 349.8 | F73: 5.8 | G73: 322.2 | H73: 16.7 | I73: 916.2 | J73: 31.8 | K73: 0.6 | L73: 0.2 | M73: =G73/E73 -> 0.92109777015437388 | N73: =I73/E73 -> 2.619210977701544 | O73: 7 | P73: 1.8 | Q73: 56.1
A74: Archie | B74: GAM | C74: 上单 | D74: 0 | E74: 337.3 | F74: 6.8 | G74: 308.2 | H74: 15.9 | I74: 848.4 | J74: 29.5 | K74: 0.4 | L74: 0.1 | M74: =G74/E74 -> 0.91372665283130738 | N74: =I74/E74 -> 2.5152683071449746 | O74: 7 | P74: 1.1 | Q74: 54.7
A75: Chawy | B75: AHQ | C75: 中单 | D75: 0 | E75: 364.2 | F75: 8.6 | G75: 330.2 | H75: 5.8 | I75: 284.9 | J75: 3.2 | K75: 0.3 | L75: 0.3 | M75: =G75/E75 -> 0.90664470071389347 | N75: =I75/E75 -> 0.78226249313563967 | O75: 2 | P75: 1.6 | Q75: 83.3
A76: MMD | B76: FW | C76: 上单 | D76: 0 | E76: 347.9 | F76: 7.4 | G76: 312 | H76: 16.5 | I76: 989.9 | J76: 31.9 | K76: 0.5 | L76: 0.1 | M76: =G76/E76 -> 0.89680942799655083 | N76: =I76/E76 -> 2.845357861454441 | O76: 6 | P76: 1.7 | Q76: 58.1
A77: Evi | B77: RPG | C77: 上单 | D77: 0 | E77: 322 | F77: 7.6 | G77: 285.2 | H77: 22.5 | I77: 694.3 | J77: 24.4 | K77: 0.5 | L77: 0 | M77: =G77/E77 -> 0.88571428571428568 | N77: =I77/E77 -> 2.1562111801242234 | O77: 4 | P77: 0.7 | Q77: 66.6
A78: Alphari | B78: MSF | C78: 上单 | D78: 1 | E78: 372.8 | F78: 8.4 | G78: 329.5 | H78: 17.9 | I78: 710.1 | J78: 27.6 | K78: 0.6 | L78: 0.1 | M78: =G78/E78 -> 0.88385193133047213 | N78: =I78/E78 -> 1.904774678111588 | O78: 12 | P78: 3.1 | Q78: 63.1
A79: Xmithie | B79: IMT | C79: 打野 | D79: 0 | E79: 311.2 | F79: 3.8 | G79: 273.5 | H79: 13.8 | I79: 818.7 | J79: 30.1 | K79: 1 | L79: 0.3 | M79: =G79/E79 -> 0.87885604113110538 | N79: =I79/E79 -> 2.6307840616966582 | O79: 7 | P79: 2.8 | Q79: 67.7
A80: Ren | B80: YG | C80: 上单 | D80: 0 | E80: 344.7 | F80: 7.8 | G80: 278.2 | H80: 6.2 | I80: 800.1 | J80: 11.2 | K80: 0.5 | L80: 0 | M80: =G80/E80 -> 0.80707861908906298 | N80: =I80/E80 -> 2.3211488250652743 | O80: 2 | P80: 0.5 | Q80: 26.6
A81: MLXG | B81: RNG | C81: 打野 | D81: 2 | E81: 327.7 | F81: 4.1 | G81: 261.2 | H81: 13.4 | I81: 783.9 | J81: 28.5 | K81: 0.9 | L81: 0.3 | M81: =G81/E81 -> 0.7970704913030211 | N81: =I81/E81 -> 2.392126945376869 | O81: 15 | P81: 3.6 | Q81: 76.5
A82: Diamondprox | B82: GMB | C82: 打野 | D82: 0 | E82: 304.3 | F82: 4.1 | G82: 239 | H82: 15.1 | I82: 880.9 | J82: 27 | K82: 0.9 | L82: 0.1 | M82: =G82/E82 -> 0.78540913572132764 | N82: =I82/E82 -> 2.8948406178113704 | O82: 4 | P82: 1 | Q82: 77.2
A83: Gemini | B83: HKA | C83: 打野 | D83: 0 | E83: 282.9 | F83: 4.2 | G83: 214.2 | H83: 1.3 | I83: 957.2 | J83: 4.1 | K83: 1.1 | L83: 0.2 | M83: =G83/E83 -> 0.75715800636267239 | N83: =I83/E83 -> 3.383527748320962 | O83: 1 | P83: 2.2 | Q83: 90
A84: Yutorimoyasi | B84: RPG | C84: ADC | D84: 0 | E84: 358.7 | F84: 9.4 | G84: 267.2 | H84: 21.1 | I84: 425.1 | J84: 14.9 | K84: 0.4 | L84: 0.1 | M84: =G84/E84 -> 0.74491218288263172 | N84: =I84/E84 -> 1.1851129077223308 | O84: 4 | P84: 0.8 | Q84: 40
A85: Oddie | B85: Lyon | C85: 打野 | D85: 1 | E85: 302.6 | F85: 3.8 | G85: 224 | H85: 10.5 | I85: 875.8 | J85: 31.9 | K85: 0.7 | L85: 0.3 | M85: =G85/E85 -> 0.74025115664243224 | N85: =I85/E85 -> 2.8942498347653665 | O85: 7 | P85: 3.4 | Q85: 82.8
A86: Shernfire | B86: DW | C86: 打野 | D86: 0 | E86: 320.9 | F86: 3.9 | G86: 232.8 | H86: 11.7 | I86: 842.8 | J86: 29 | K86: 1 | L86: 0.3 | M86: =G86/E86 -> 0.72545964474914315 | N86: =I86/E86 -> 2.6263633530694923 | O86: 5 | P86: 2.6 | Q86: 71.4
A87: Karsa | B87: FW | C87: 打野 | D87: 1 | E87: 312.6 | F87: 4.1 | G87: 225.7 | H87: 11.9 | I87: 911.1 | J87: 29.4 | K87: 1.1 | L87: 0.3 | M87: =G87/E87 -> 0.72200895713371716 | N87: =I87/E87 -> 2.9145873320537428 | O87: 6 | P87: 2.2 | Q87: 76.7
A88: 4LAN | B88: oNe | C88: 打野 | D88: 1 | E88: 321 | F88: 4.2 | G88: 231.6 | H88: 13.6 | I88: 880.4 | J88: 29.3 | K88: 0.8 | L88: 0.2 | M88: =G88/E88 -> 0.72149532710280373 | N88: =I88/E88 -> 2.7426791277258564 | O88: 9 | P88: 1.6 | Q88: 62
A89: Crash | B89: VG | C89: 打野 | D89: 2 | E89: 340.3 | F89: 4.9 | G89: 240.9 | H89: 11.8 | I89: 937.3 | J89: 32.3 | K89: 0.8 | L89: 0.4 | M89: =G89/E89 -> 0.70790478989127237 | N89: =I89/E89 -> 2.7543344108139873 | O89: 15 | P89: 3.1 | Q89: 70.3
A90: Ambition | B90: SSG | C90: 打野 | D90: 5 | E90: 348.4 | F90: 4.6 | G90: 246.3 | H90: 11 | I90: 863.7 | J90: 30.6 | K90: 0.9 | L90: 0.3 | M90: =G90/E90 -> 0.70694603903559139 | N90: =I90/E90 -> 2.4790470723306548 | O90: 15 | P90: 4.2 | Q90: 80.9
A91: Cuzz | B91: LZ | C91: 打野 | D91: 2 | E91: 322.4 | F91: 3.5 | G91: 227.6 | H91: 10.9 | I91: 902.4 | J91: 32.6 | K91: 0.9 | L91: 0.4 | M91: =G91/E91 -> 0.70595533498759311 | N91: =I91/E91 -> 2.7990074441687347 | O91: 9 | P91: 3.5 | Q91: 75.4
A92: Condi | B92: WE | C92: 打野 | D92: 7 | E92: 337.3 | F92: 4.1 | G92: 238 | H92: 11.3 | I92: 823.4 | J92: 29.2 | K92: 0.9 | L92: 0.3 | M92: =G92/E92 -> 0.70560332048621399 | N92: =I92/E92 -> 2.4411503112955826 | O92: 22 | P92: 4.5 | Q92: 67.1
A93: Edward | B93: GMB | C93: 辅助 | D93: 0 | E93: 254.4 | F93: 1.4 | G93: 178.6 | H93: 11.3 | I93: 480.4 | J93: 14.7 | K93: 1.2 | L93: 0.3 | M93: =G93/E93 -> 0.70204402515723263 | N93: =I93/E93 -> 1.8883647798742138 | O93: 4 | P93: 0.5 | Q93: 45.4
A94: Trick | B94: G2 | C94: 打野 | D94: 1 | E94: 316.3 | F94: 4.1 | G94: 207.3 | H94: 9.4 | I94: 1010.8 | J94: 30.9 | K94: 0.8 | L94: 0.2 | M94: =G94/E94 -> 0.65539045210243441 | N94: =I94/E94 -> 3.1957002845399933 | O94: 6 | P94: 3.3 | Q94: 78.5
A95: GodKwai | B95: HKA | C95: 打野 | D95: 2 | E95: 316.5 | F95: 4 | G95: 205.5 | H95: 9.4 | I95: 862.1 | J95: 27.5 | K95: 0.8 | L95: 0.3 | M95: =G95/E95 -> 0.64928909952606639 | N95: =I95/E95 -> 2.7238546603475515 | O95: 7 | P95: 3.6 | Q95: 79.6
A96: Mountain | B96: AHQ | C96: 打野 | D96: 1 | E96: 312.9 | F96: 4.7 | G96: 202.2 | H96: 11.9 | I96: 950.9 | J96: 35.5 | K96: 0.7 | L96: 0.4 | M96: =G96/E96 -> 0.64621284755512942 | N96: =I96/E96 -> 3.038990092681368 | O96: 6 | P96: 2.1 | Q96: 82.3
A97: clearlove7 | B97: EDG | C97: 打野 | D97: 0 | E97: 322.9 | F97: 3.6 | G97: 208 | H97: 9.8 | I97: 865.7 | J97: 30.4 | K97: 1 | L97: 0.3 | M97: =G97/E97 -> 0.64416227934345005 | N97: =I97/E97 -> 2.6810157943635802 | O97: 6 | P97: 4.3 | Q97: 75.6
A98: Svenskeren | B98: TSM | C98: 打野 | D98: 1 | E98: 301.6 | F98: 3.4 | G98: 193.1 | H98: 9.3 | I98: 1020.8 | J98: 34.7 | K98: 0.9 | L98: 0.2 | M98: =G98/E98 -> 0.64025198938992034 | N98: =I98/E98 -> 3.3846153846153841 | O98: 7 | P98: 1.7 | Q98: 77.5
A99: Broxah | B99: FNC | C99: 打野 | D99: 3 | E99: 327.2 | F99: 4 | G99: 208.3 | H99: 10.6 | I99: 687.1 | J99: 25.7 | K99: 0.8 | L99: 0.3 | M99: =G99/E99 -> 0.63661369193154038 | N99: =I99/E99 -> 2.0999388753056234 | O99: 19 | P99: 6.1 | Q99: 67.1
A100: Tierwulf | B100: KLG | C100: 打野 | D100: 0 | E100: 299.1 | F100: 3.9 | G100: 187.9 | H100: 11.4 | I100: 842.7 | J100: 29.5 | K100: 0.9 | L100: 0.3 | M100: =G100/E100 -> 0.62821798729521894 | N100: =I100/E100 -> 2.8174523570712138 | O100: 4 | P100: 2 | Q100: 81.8
A101: REDBERT | B101: oNe | C101: 辅助 | D101: 0 | E101: 281.1 | F101: 1.1 | G101: 172.7 | H101: 10.1 | I101: 470 | J101: 15.6 | K101: 1.2 | L101: 0.1 | M101: =G101/E101 -> 0.61437210956954813 | N101: =I101/E101 -> 1.6720028459622909 | O101: 9 | P101: 2.7 | Q101: 74.7
A102: Maxlore | B102: MSF | C102: 打野 | D102: 1 | E102: 322.7 | F102: 4 | G102: 195.6 | H102: 10.6 | I102: 777.3 | J102: 30.2 | K102: 1 | L102: 0.3 | M102: =G102/E102 -> 0.60613572977998142 | N102: =I102/E102 -> 2.4087387666563371 | O102: 12 | P102: 3.1 | Q102: 71.9
A103: Palette | B103: YG | C103: 辅助 | D103: 1 | E103: 274.8 | F103: 1.1 | G103: 166 | H103: 9.7 | I103: 344.9 | J103: 12.6 | K103: 1.3 | L103: 0.4 | M103: =G103/E103 -> 0.60407569141193596 | N103: =I103/E103 -> 1.2550946142649198 | O103: 7 | P103: 3.9 | Q103: 75.4
A104: Tussle | B104: RPG | C104: 打野 | D104: 0 | E104: 303.7 | F104: 4.7 | G104: 179.9 | H104: 14.2 | I104: 911 | J104: 32 | K104: 0.7 | L104: 0.3 | M104: =G104/E104 -> 0.59236088244978602 | N104: =I104/E104 -> 2.9996707276918011 | O104: 4 | P104: 0.9 | Q104: 66.6
A105: Blank | B105: SKT | C105: 打野 | D105: 1 | E105: 304.5 | F105: 3 | G105: 176 | H105: 4.8 | I105: 804.5 | J105: 14.2 | K105: 1.1 | L105: 0.3 | M105: =G105/E105 -> 0.57799671592775037 | N105: =I105/E105 -> 2.6420361247947457 | O105: 9 | P105: 2.7 | Q105: 74.1
A106: Peanut | B106: SKT | C106: 打野 | D106: 2 | E106: 319.4 | F106: 3.7 | G106: 183.3 | H106: 5.3 | I106: 783.2 | J106: 14.6 | K106: 0.8 | L106: 0.4 | M106: =G106/E106 -> 0.57388854101440212 | N106: =I106/E106 -> 2.4520976831559178 | O106: 10 | P106: 4 | Q106: 77.9
A107: Venus | B107: YG | C107: 打野 | D107: 0 | E107: 326.7 | F107: 4.7 | G107: 181.8 | H107: 10.7 | I107: 677.6 | J107: 24.9 | K107: 1 | L107: 0.4 | M107: =G107/E107 -> 0.556473829201102 | N107: =I107/E107 -> 2.0740740740740744 | O107: 7 | P107: 3.3 | Q107: 57.8
A108: Destiny | B108: DW | C108: 辅助 | D108: 0 | E108: 291.9 | F108: 0.5 | G108: 161.2 | H108: 8.1 | I108: 335.7 | J108: 11.5 | K108: 1 | L108: 0.1 | M108: =G108/E108 -> 0.55224391915039395 | N108: =I108/E108 -> 1.1500513874614595 | O108: 5 | P108: 4.8 | Q108: 85.7
A109: Genthix | B109: Lyon | C109: 辅助 | D109: 0 | E109: 257.3 | F109: 0.9 | G109: 136.9 | H109: 6.4 | I109: 353 | J109: 12.8 | K109: 1.2 | L109: 0.3 | M109: =G109/E109 -> 0.53206373882627278 | N109: =I109/E109 -> 1.3719393703847649 | O109: 7 | P109: 3.3 | Q109: 81.4
A110: Slow | B110: KLG | C110: 辅助 | D110: 0 | E110: 268.6 | F110: 1 | G110: 136.3 | H110: 8.2 | I110: 383.1 | J110: 13.4 | K110: 1 | L110: 0.2 | M110: =G110/E110 -> 0.50744601638123599 | N110: =I110/E110 -> 1.4262844378257631 | O110: 4 | P110: 1.8 | Q110: 77.2
A111: Sya | B111: GAM | C111: 辅助 | D111: 0 | E111: 305.9 | F111: 0.5 | G111: 147.5 | H111: 4.8 | I111: 331.1 | J111: 7.3 | K111: 1.2 | L111: 0.3 | M111: =G111/E111 -> 0.48218372016999023 | N111: =I111/E111 -> 1.082379862700229 | O111: 4 | P111: 1.9 | Q111: 55.5
A112: Nevan | B112: GAM | C112: 辅助 | D112: 0 | E112: 284.9 | F112: 0.5 | G112: 134.2 | H112: 2.5 | I112: 278.8 | J112: 3.4 | K112: 1 | L112: 0.2 | M112: =G112/E112 -> 0.47104247104247104 | N112: =I112/E112 -> 0.97858897858897875 | O112: 3 | P112: 2.8 | Q112: 82.1
A113: Biofrost | B113: TSM | C113: 辅助 | D113: 0 | E113: 292.1 | F113: 0.8 | G113: 124.2 | H113: 6 | I113: 295.1 | J113: 10 | K113: 1 | L113: 0.3 | M113: =G113/E113 -> 0.42519685039370075 | N113: =I113/E113 -> 1.0102704553235193 | O113: 7 | P113: 3.6 | Q113: 81.6
A114: Zero | B114: WE | C114: 辅助 | D114: 1 | E114: 337.5 | F114: 0.4 | G114: 131.6 | H114: 0.7 | I114: 392.1 | J114: 1.7 | K114: 1.1 | L114: 0.1 | M114: =G114/E114 -> 0.3899259259259259 | N114: =I114/E114 -> 1.1617777777777778 | O114: 3 | P114: 23 | Q114: 74.1
A115: GorillA | B115: LZ | C115: 辅助 | D115: 1 | E115: 323.6 | F115: 0.9 | G115: 119.2 | H115: 5.7 | I115: 342 | J115: 12.3 | K115: 1.3 | L115: 0.2 | M115: =G115/E115 -> 0.36835599505562422 | N115: =I115/E115 -> 1.0568603213844252 | O115: 9 | P115: 4.5 | Q115: 83.3
A116: Jesiz | B116: FNC | C116: 辅助 | D116: 2 | E116: 325.2 | F116: 0.6 | G116: 117.2 | H116: 5.9 | I116: 295.9 | J116: 11 | K116: 1.3 | L116: 0.1 | M116: =G116/E116 -> 0.36039360393603936 | N116: =I116/E116 -> 0.9099015990159901 | O116: 19 | P116: 5.5 | Q116: 76.6
A117: Olleh | B117: IMT | C117: 辅助 | D117: 0 | E117: 318.8 | F117: 0.8 | G117: 112 | H117: 5.6 | I117: 231.6 | J117: 8.5 | K117: 1.3 | L117: 0.3 | M117: =G117/E117 -> 0.35131744040150564 | N117: =I117/E117 -> 0.72647427854454194 | O117: 7 | P117: 3 | Q117: 72.8
A118: Dara | B118: RPG | C118: 辅助 | D118: 0 | E118: 260.2 | F118: 0.9 | G118: 91.2 | H118: 7.2 | I118: 373.2 | J118: 13.1 | K118: 1 | L118: 0.2 | M118: =G118/E118 -> 0.35049961568024601 | N118: =I118/E118 -> 1.434281322059954 | O118: 4 | P118: 0.9 | Q118: 60
A119: Kaiwing | B119: HKA | C119: 辅助 | D119: 0 | E119: 284.2 | F119: 0.9 | G119: 98.5 | H119: 5.1 | I119: 305.1 | J119: 11.1 | K119: 1.2 | L119: 0.2 | M119: =G119/E119 -> 0.34658691062631952 | N119: =I119/E119 -> 1.0735397607318791 | O119: 8 | P119: 4.6 | Q119: 81
A120: Wolf | B120: SKT | C120: 辅助 | D120: 2 | E120: 296.1 | F120: 0.9 | G120: 102.3 | H120: 5.7 | I120: 274.2 | J120: 9.9 | K120: 1.1 | L120: 0.3 | M120: =G120/E120 -> 0.34549138804457952 | N120: =I120/E120 -> 0.92603850050658554 | O120: 19 | P120: 3.9 | Q120: 73.5
A121: IgNar | B121: MSF | C121: 辅助 | D121: 0 | E121: 291.6 | F121: 1.1 | G121: 97.9 | H121: 5.3 | I121: 311.9 | J121: 12.1 | K121: 1.5 | L121: 0.3 | M121: =G121/E121 -> 0.33573388203017834 | N121: =I121/E121 -> 1.0696159122085047 | O121: 12 | P121: 4.5 | Q121: 78.9
A122: Japone | B122: FB | C122: 辅助 | D122: 1 | E122: 293.9 | F122: 0.7 | G122: 97 | H122: 4.7 | I122: 268.5 | J122: 9.2 | K122: 1.3 | L122: 0.3 | M122: =G122/E122 -> 0.33004423273222189 | N122: =I122/E122 -> 0.91357604627424305 | O122: 15 | P122: 4 | Q122: 76.3
A123: COREJJ | B123: SSG | C123: 辅助 | D123: 2 | E123: 318.4 | F123: 0.9 | G123: 103.8 | H123: 5 | I123: 245.8 | J123: 9.5 | K123: 1.1 | L123: 0.3 | M123: =G123/E123 -> 0.32600502512562818 | N123: =I123/E123 -> 0.77198492462311563 | O123: 16 | P123: 7.9 | Q123: 83.8
A124: Ming | B124: RNG | C124: 辅助 | D124: 2 | E124: 312.6 | F124: 0.4 | G124: 91.1 | H124: 4.6 | I124: 243.1 | J124: 8.8 | K124: 1.3 | L124: 0.2 | M124: =G124/E124 -> 0.29142674344209851 | N124: =I124/E124 -> 0.77767114523352521 | O124: 15 | P124: 6.3 | Q124: 79.7
A125: meiko | B125: EDG | C125: 辅助 | D125: 0 | E125: 325.1 | F125: 0.9 | G125: 92.5 | H125: 4.3 | I125: 248.5 | J125: 8.7 | K125: 1.4 | L125: 0.3 | M125: =G125/E125 -> 0.28452783758843431 | N125: =I125/E125 -> 0.76438019071055052 | O125: 6 | P125: 7.6 | Q125: 82.4
A126: Smoothie | B126: C9 | C126: 辅助 | D126: 1 | E126: 313.9 | F126: 0.5 | G126: 88.3 | H126: 3.9 | I126: 252.1 | J126: 9.1 | K126: 1.2 | L126: 0.2 | M126: =G126/E126 -> 0.28129977699904429 | N126: =I126/E126 -> 0.8031220133800574 | O126: 18 | P126: 9.2 | Q126: 79.2
A127: SwordArt | B127: FW | C127: 辅助 | D127: 0 | E127: 291.6 | F127: 0.4 | G127: 78 | H127: 4.1 | I127: 260.2 | J127: 8.4 | K127: 1 | L127: 0.1 | M127: =G127/E127 -> 0.26748971193415638 | N127: =I127/E127 -> 0.89231824417009586 | O127: 6 | P127: 4.2 | Q127: 88.3
A128: Ben | B128: WE | C128: 辅助 | D128: 2 | E128: 330 | F128: 0.8 | G128: 85.5 | H128: 3.5 | I128: 277.4 | J128: 8.6 | K128: 1.2 | L128: 0.2 | M128: =G128/E128 -> 0.25909090909090909 | N128: =I128/E128 -> 0.84060606060606058 | O128: 19 | P128: 5.5 | Q128: 78
A129: Mithy | B129: G2 | C129: 辅助 | D129: 1 | E129: 318.3 | F129: 0.5 | G129: 76.3 | H129: 3.4 | I129: 251.4 | J129: 7.7 | K129: 1.1 | L129: 0.2 | M129: =G129/E129 -> 0.23971096449890039 | N129: =I129/E129 -> 0.78982092365692746 | O129: 6 | P129: 6.4 | Q129: 80.3
A130: Albis | B130: AHQ | C130: 辅助 | D130: 0 | E130: 296.2 | F130: 0.7 | G130: 63.4 | H130: 3.7 | I130: 182 | J130: 6.8 | K130: 1.1 | L130: 0.2 | M130: =G130/E130 -> 0.21404456448345713 | N130: =I130/E130 -> 0.61444969615124923 | O130: 6 | P130: 3.7 | Q130: 76.4