A1: 选手名字 | B1: 所属队伍 | C1: 位置 | D1: Mvp | E1: 分均经济 | F1: 分均补刀 | G1: 分均伤害 | H1: 伤害占比 | I1: 分均承伤 | J1: 承伤占比 | K1: 分均放眼 | L1: 分均拆眼 | M1: 伤害/经济 | N1: 承伤/经济 | O1: 出场次数 | P1: KDA | Q1: 场均参团率 | R1: 最擅长的英雄
A2: Zero | B2: WE | C2: 辅助 | D2: 1 | E2: 262.5 | F2: 1.8 | G2: 172.5 | H2: 0.3 | I2: 485.9 | J2: 0.7 | K2: 1.2 | L2: 0.3 | M2: =G2/E2 -> 0.65714285714285714 | N2: =I2/E2 -> 1.8510476190476191 | O2: 2 | P2: 2.5 | Q2: 0.695 | R2: 201,12,432
A3: xiye | B3: WE | C3: 中单 | D3: 6 | E3: 441 | F3: 10.2 | G3: 558.1 | H3: 29.6 | I3: 488 | J3: 17.7 | K3: 0.4 | L3: 0.2 | M3: =G3/E3 -> 1.2655328798185941 | N3: =I3/E3 -> 1.1065759637188208 | O3: 38 | P3: 4.8676 | Q3: 0.76 | R3: 7,42,13
A4: MyStic | B4: WE | C4: ADC | D4: 4 | E4: 460.1 | F4: 10.8 | G4: 619 | H4: 32.8 | I4: 356.7 | J4: 13 | K4: 0.4 | L4: 0.6 | M4: =G4/E4 -> 1.3453597044120842 | N4: =I4/E4 -> 0.775266246468159 | O4: 38 | P4: 3.3789 | Q4: 0.702 | R4: 81,15,22
A5: Melon | B5: WE | C5: 打野 | D5: 1 | E5: 322.2 | F5: 4.5 | G5: 157.4 | H5: 1.4 | I5: 818.9 | J5: 5 | K5: 1.6 | L5: 0.5 | M5: =G5/E5 -> 0.4885164494103042 | N5: =I5/E5 -> 2.5415890751086283 | O5: 7 | P5: 2.55 | Q5: 0.762 | R5: 59,113,79
A6: Magic | B6: WE | C6: 打野 | D6: 4 | E6: 299.2 | F6: 4.3 | G6: 187.4 | H6: 5.8 | I6: 759.3 | J6: 16.1 | K6: 1.6 | L6: 0.4 | M6: =G6/E6 -> 0.62633689839572193 | N6: =I6/E6 -> 2.5377673796791442 | O6: 21 | P6: 4.6889 | Q6: 0.798 | R6: 59,421,2
A7: Condi | B7: WE | C7: 打野 | D7: 2 | E7: 332.8 | F7: 5.1 | G7: 159.3 | H7: 2 | I7: 914.2 | J7: 8.2 | K7: 1.5 | L7: 0.6 | M7: =G7/E7 -> 0.47866586538461542 | N7: =I7/E7 -> 2.7469951923076925 | O7: 10 | P7: 3.6316 | Q7: 0.734 | R7: 79,104,64
A8: Celestial | B8: WE | C8: 辅助 | D8: 1 | E8: 258.3 | F8: 1.6 | G8: 125.9 | H8: 3.6 | I8: 490.3 | J8: 9.7 | K8: 1.7 | L8: 0.2 | M8: =G8/E8 -> 0.48741773132017036 | N8: =I8/E8 -> 1.8981804103755322 | O8: 19 | P8: 4.0213 | Q8: 0.736 | R8: 201497223.
A9: Ben | B9: WE | C9: 辅助 | D9: 0 | E9: 293.1 | F9: 2.7 | G9: 134 | H9: 2.9 | I9: 372 | J9: 5.6 | K9: 1.3 | L9: 0.4 | M9: =G9/E9 -> 0.45718184919822585 | N9: =I9/E9 -> 1.2691914022517912 | O9: 17 | P9: 3.6667 | Q9: 0.717 | R9: 117412201.
A10: 957 | B10: WE | C10: 上单 | D10: 1 | E10: 396.4 | F10: 8.5 | G10: 400.6 | H10: 21.2 | I10: 648.9 | J10: 23.6 | K10: 0.6 | L10: 0.1 | M10: =G10/E10 -> 1.0105953582240164 | N10: =I10/E10 -> 1.6369828456104945 | O10: 38 | P10: 4.5614 | Q10: 0.559 | R10: 57,98,150
A11: Swift | B11: VG | C11: 打野 | D11: 2 | E11: 318.3 | F11: 5.4 | G11: 264.1 | H11: 8.9 | I11: 782 | J11: 16.9 | K11: 1.2 | L11: 0.5 | M11: =G11/E11 -> 0.82972038956958849 | N11: =I11/E11 -> 2.4568017593465283 | O11: 21 | P11: 2.2381 | Q11: 0.726 | R11: 79,64,421
A12: Snow | B12: VG | C12: ADC | D12: 1 | E12: 406.3 | F12: 9.7 | G12: 551.1 | H12: 5.5 | I12: 298.5 | J12: 1.9 | K12: 0.4 | L12: 0.2 | M12: =G12/E12 -> 1.356386906226926 | N12: =I12/E12 -> 0.73467880876199854 | O12: 7 | P12: 3.4615 | Q12: 0.694 | R12: 202,81,22
A13: Meow | B13: VG | C13: 上单 | D13: 0 | E13: 359.9 | F13: 7.8 | G13: 381.8 | H13: 11.5 | I13: 703.1 | J13: 13.6 | K13: 0.7 | L13: 0.1 | M13: =G13/E13 -> 1.0608502361767158 | N13: =I13/E13 -> 1.9535982217282581 | O13: 19 | P13: 1.3443 | Q13: 0.579 | R13: 150,14,41
A14: Martin | B14: VG | C14: ADC | D14: 0 | E14: 425.7 | F14: 10.3 | G14: 588.3 | H14: 26.9 | I14: 377.2 | J14: 11.1 | K14: 0.4 | L14: 0.3 | M14: =G14/E14 -> 1.3819591261451727 | N14: =I14/E14 -> 0.88607000234907207 | O14: 29 | P14: 1.9231 | Q14: 0.598 | R14: 96,51,110
A15: Loong | B15: VG | C15: 上单 | D15: 0 | E15: 359.2 | F15: 8.3 | G15: 340.3 | H15: 8.7 | I15: 690.6 | J15: 11.4 | K15: 0.5 | L15: 0.1 | M15: =G15/E15 -> 0.94738307349665929 | N15: =I15/E15 -> 1.9226057906458798 | O15: 17 | P15: 1.9512 | Q15: 0.578 | R15: 98,78,68
A16: FireRain | B16: VG | C16: 中单 | D16: 0 | E16: 333.3 | F16: 8.9 | G16: 242.3 | H16: 0.8 | I16: 549.9 | J16: 1.2 | K16: 0.5 | L16: 0.2 | M16: =G16/E16 -> 0.72697269726972702 | N16: =I16/E16 -> 1.6498649864986497 | O16: 3 | P16: 0.5 | Q16: 0.443 | R16: 13,8
A17: Easyhoon | B17: VG | C17: 中单 | D17: 2 | E17: 395.9 | F17: 9.7 | G17: 478.8 | H17: 25.1 | I17: 414.3 | J17: 14 | K17: 0.4 | L17: 0.3 | M17: =G17/E17 -> 1.2093963122000506 | N17: =I17/E17 -> 1.0464763829249812 | O17: 33 | P17: 2.4783 | Q17: 0.572 | R17: 61,43,268
A18: Crash | B18: VG | C18: 打野 | D18: 1 | E18: 318.7 | F18: 5.4 | G18: 184.3 | H18: 4 | I18: 865.9 | J18: 12.3 | K18: 1.6 | L18: 0.6 | M18: =G18/E18 -> 0.57828679008471928 | N18: =I18/E18 -> 2.7169752117979291 | O18: 15 | P18: 1.2195 | Q18: 0.654 | R18: 79,64,121
A19: Caveman | B19: VG | C19: 辅助 | D19: 2 | E19: 256.7 | F19: 2.1 | G19: 144.9 | H19: 8.1 | I19: 477.4 | J19: 17.2 | K19: 1.3 | L19: 0.5 | M19: =G19/E19 -> 0.56447214647448385 | N19: =I19/E19 -> 1.859758472925594 | O19: 36 | P19: 1.8868 | Q19: 0.664 | R19: 201,12,412
A20: XX | B20: TOP | C20: 打野 | D20: 1 | E20: 309.3 | F20: 5.1 | G20: 224.3 | H20: 6.1 | I20: 808 | J20: 13.8 | K20: 1.1 | L20: 0.5 | M20: =G20/E20 -> 0.72518590365341096 | N20: =I20/E20 -> 2.6123504688005172 | O20: 19 | P20: 1.7018 | Q20: 0.662 | R20: 121,113,2
A21: Qiuqiu | B21: TOP | C21: ADC | D21: 1 | E21: 419.6 | F21: 10 | G21: 532.5 | H21: 30.2 | I21: 353.8 | J21: 12.5 | K21: 0.4 | L21: 0.4 | M21: =G21/E21 -> 1.2690657769304099 | N21: =I21/E21 -> 0.84318398474737843 | O21: 40 | P21: 2.027 | Q21: 0.645 | R21: 110,202,51
A22: Moyu | B22: TOP | C22: 上单 | D22: 0 | E22: 388.4 | F22: 8.8 | G22: 392.2 | H22: 5.8 | I22: 666.6 | J22: 6.2 | K22: 0.4 | L22: 0.1 | M22: =G22/E22 -> 1.009783728115345 | N22: =I22/E22 -> 1.7162718846549949 | O22: 11 | P22: 1.2069 | Q22: 0.633 | R22: 41,150,24
A23: MaRin | B23: TOP | C23: 上单 | D23: 0 | E23: 389.8 | F23: 9.1 | G23: 421.4 | H23: 15.3 | I23: 698.7 | J23: 15.8 | K23: 0.5 | L23: 0.2 | M23: =G23/E23 -> 1.0810672139558748 | N23: =I23/E23 -> 1.7924576706003079 | O23: 25 | P23: 2.0714 | Q23: 0.6 | R23: 150,68,48
A24: Lies | B24: TOP | C24: 上单 | D24: 0 | E24: 336.5 | F24: 7.6 | G24: 349.9 | H24: 1.9 | I24: 633.7 | J24: 2.2 | K24: 0.6 | L24: 0.1 | M24: =G24/E24 -> 1.039821693907875 | N24: =I24/E24 -> 1.8832095096582468 | O24: 4 | P24: 0.875 | Q24: 0.375 | R24: 57,98,78
A25: Karin | B25: TOP | C25: 打野 | D25: 4 | E25: 311.2 | F25: 4.8 | G25: 203.1 | H25: 5.9 | I25: 861.6 | J25: 15.7 | K25: 1.4 | L25: 0.5 | M25: =G25/E25 -> 0.65263496143958866 | N25: =I25/E25 -> 2.7686375321336762 | O25: 21 | P25: 2.98 | Q25: 0.795 | R25: 121,104,79
A26: Ggoong | B26: TOP | C26: 中单 | D26: 3 | E26: 386.5 | F26: 9.1 | G26: 499.4 | H26: 20 | I26: 423.6 | J26: 10.6 | K26: 0.6 | L26: 0.2 | M26: =G26/E26 -> 1.2921086675291074 | N26: =I26/E26 -> 1.0959896507115137 | O26: 28 | P26: 2.5645 | Q26: 0.746 | R26: 163,103,42
A27: fage | B27: TOP | C27: 辅助 | D27: 0 | E27: 245.9 | F27: 1.9 | G27: 136.2 | H27: 2.5 | I27: 479.6 | J27: 5.7 | K27: 1.3 | L27: 0.2 | M27: =G27/E27 -> 0.55388369255795034 | N27: =I27/E27 -> 1.9503863359089062 | O27: 15 | P27: 1.3636 | Q27: 0.648 | R27: 12497223.
A28: Corn | B28: TOP | C28: 中单 | D28: 0 | E28: 384.9 | F28: 8.9 | G28: 414.1 | H28: 6.9 | I28: 515.7 | J28: 5.3 | K28: 0.6 | L28: 0.1 | M28: =G28/E28 -> 1.0758638607430502 | N28: =I28/E28 -> 1.3398285268901016 | O28: 12 | P28: 3.2308 | Q28: 0.643 | R28: 3,245,43
A29: Cat | B29: TOP | C29: 辅助 | D29: 0 | E29: 267.7 | F29: 2.2 | G29: 131.5 | H29: 4.9 | I29: 503.6 | J29: 11.8 | K29: 1.6 | L29: 0.4 | M29: =G29/E29 -> 0.49122151662308555 | N29: =I29/E29 -> 1.881210310048562 | O29: 25 | P29: 1.8354 | Q29: 0.628 | R29: 412223143.
A30: Sofm | B30: SS | C30: 打野 | D30: 9 | E30: 333.4 | F30: 5.2 | G30: 178.9 | H30: 9.1 | I30: 769.6 | J30: 28.9 | K30: 2.3 | L30: 0.7 | M30: =G30/E30 -> 0.53659268146370731 | N30: =I30/E30 -> 2.3083383323335336 | O30: 38 | P30: 3.4483 | Q30: 0.722 | R30: 79,421,64
A31: Light | B31: SS | C31: ADC | D31: 0 | E31: 405.3 | F31: 10.8 | G31: 374 | H31: 0.4 | I31: 343.3 | J31: 0.2 | K31: 0.2 | L31: 0.2 | M31: =G31/E31 -> 0.922773254379472 | N31: =I31/E31 -> 0.84702689365901807 | O31: 1 | P31: 2 | Q31: 0.5 | R31: 18,90
A32: kRYST4L | B32: SS | C32: ADC | D32: 3 | E32: 447.6 | F32: 10.3 | G32: 604.6 | H32: 30.2 | I32: 359.4 | J32: 13.2 | K32: 0.3 | L32: 0.4 | M32: =G32/E32 -> 1.3507596067917784 | N32: =I32/E32 -> 0.80294906166219826 | O32: 37 | P32: 3.8205 | Q32: 0.746 | R32: 110,15,236
A33: Hudie | B33: SS | C33: 辅助 | D33: 3 | E33: 274 | F33: 2.2 | G33: 118.6 | H33: 6 | I33: 483.4 | J33: 18.1 | K33: 1.6 | L33: 0.3 | M33: =G33/E33 -> 0.43284671532846714 | N33: =I33/E33 -> 1.7642335766423356 | O33: 38 | P33: 3.4 | Q33: 0.657 | R33: 201,223,12
A34: Guoguo | B34: SS | C34: 中单 | D34: 1 | E34: 422.7 | F34: 9.9 | G34: 501 | H34: 25.6 | I34: 393.2 | J34: 14.7 | K34: 0.5 | L34: 0.2 | M34: =G34/E34 -> 1.1852377572746629 | N34: =I34/E34 -> 0.93021055121835816 | O34: 38 | P34: 4.8571 | Q34: 0.728 | R34: 268,13,61
A35: Flandre | B35: SS | C35: 上单 | D35: 7 | E35: 454.5 | F35: 10 | G35: 558.2 | H35: 28.5 | I35: 656.3 | J35: 24.6 | K35: 0.5 | L35: 0.2 | M35: =G35/E35 -> 1.2281628162816283 | N35: =I35/E35 -> 1.4440044004400439 | O35: 38 | P35: 3.7632 | Q35: 0.662 | R35: 57,150,78
A36: YOON | B36: SNG | C36: 辅助 | D36: 1 | E36: 276.4 | F36: 2 | G36: 127.6 | H36: 6.5 | I36: 448.3 | J36: 16.4 | K36: 1.4 | L36: 0.2 | M36: =G36/E36 -> 0.46164978292329956 | N36: =I36/E36 -> 1.6219247467438496 | O36: 42 | P36: 3.6526 | Q36: 0.61 | R36: 223412201.
A37: XiaoAL | B37: SNG | C37: 上单 | D37: 0 | E37: 410 | F37: 9.1 | G37: 435.5 | H37: 22.1 | I37: 706.8 | J37: 25.8 | K37: 0.5 | L37: 0.2 | M37: =G37/E37 -> 1.0621951219512196 | N37: =I37/E37 -> 1.7239024390243902 | O37: 42 | P37: 3.7683 | Q37: 0.568 | R37: 164,57,68
A38: Tian | B38: SNG | C38: 打野 | D38: 1 | E38: 336.6 | F38: 5.4 | G38: 250.4 | H38: 3.4 | I38: 854.1 | J38: 8.3 | K38: 1.6 | L38: 0.4 | M38: =G38/E38 -> 0.74390968508615563 | N38: =I38/E38 -> 2.5374331550802136 | O38: 12 | P38: 2.7714 | Q38: 0.576 | R38: 79,60,113
A39: Knight | B39: SNG | C39: 中单 | D39: 5 | E39: 439.6 | F39: 10.1 | G39: 628.3 | H39: 32 | I39: 456.7 | J39: 16.7 | K39: 0.4 | L39: 0.3 | M39: =G39/E39 -> 1.4292538671519561 | N39: =I39/E39 -> 1.0388989990900819 | O39: 42 | P39: 4.9398 | Q39: 0.743 | R39: 61163245.
A40: H4cker | B40: SNG | C40: 打野 | D40: 11 | E40: 335.2 | F40: 5.2 | G40: 193.2 | H40: 7.2 | I40: 790.8 | J40: 21.2 | K40: 1.2 | L40: 0.5 | M40: =G40/E40 -> 0.57637231503579955 | N40: =I40/E40 -> 2.3591885441527447 | O40: 30 | P40: 4.4219 | Q40: 0.731 | R40: 113,59,60
A41: Fury | B41: SNG | C41: ADC | D41: 5 | E41: 441.9 | F41: 9.8 | G41: 562.4 | H41: 28.6 | I41: 312.7 | J41: 11.4 | K41: 0.4 | L41: 0.5 | M41: =G41/E41 -> 1.2726861280832769 | N41: =I41/E41 -> 0.7076261597646526 | O41: 42 | P41: 5.4478 | Q41: 0.629 | R41: 22,110,81
A42: Smlz | B42: RW | C42: ADC | D42: 9 | E42: 481.7 | F42: 10.7 | G42: 699 | H42: 33.6 | I42: 366.2 | J42: 13 | K42: 0.3 | L42: 0.4 | M42: =G42/E42 -> 1.4511106497820221 | N42: =I42/E42 -> 0.76022420593730533 | O42: 35 | P42: 5.4407 | Q42: 0.698 | R42: 202,51,96
A43: mouse | B43: RW | C43: 上单 | D43: 3 | E43: 415.5 | F43: 8.8 | G43: 422.5 | H43: 20.3 | I43: 680.1 | J43: 24.2 | K43: 0.5 | L43: 0.1 | M43: =G43/E43 -> 1.0168471720818291 | N43: =I43/E43 -> 1.6368231046931407 | O43: 35 | P43: 5.1 | Q43: 0.583 | R43: 57,79,41
A44: killula | B44: RW | C44: 辅助 | D44: 0 | E44: 294.2 | F44: 2.2 | G44: 167.8 | H44: 8 | I44: 471.8 | J44: 16.8 | K44: 1.4 | L44: 0.2 | M44: =G44/E44 -> 0.57036029911624753 | N44: =I44/E44 -> 1.6036709721278044 | O44: 35 | P44: 4.3919 | Q44: 0.739 | R44: 223,201,12
A45: Flawless | B45: RW | C45: 打野 | D45: 11 | E45: 345.8 | F45: 5 | G45: 231.8 | H45: 11.1 | I45: 796 | J45: 28.3 | K45: 1.9 | L45: 0.6 | M45: =G45/E45 -> 0.67032967032967039 | N45: =I45/E45 -> 2.3019086176980914 | O45: 35 | P45: 4.7031 | Q45: 0.697 | R45: 121,59,64
A46: Doinb | B46: RW | C46: 中单 | D46: 4 | E46: 449.7 | F46: 10.1 | G46: 556.3 | H46: 26.7 | I46: 493.3 | J46: 17.5 | K46: 0.5 | L46: 0.3 | M46: =G46/E46 -> 1.2370469201690015 | N46: =I46/E46 -> 1.0969535245719368 | O46: 35 | P46: 5.4754 | Q46: 0.763 | R46: 112,43,7
A47: Zz1tai | B47: RNG | C47: 上单 | D47: 3 | E47: 409.6 | F47: 8.8 | G47: 429.7 | H47: 9.3 | I47: 634.9 | J47: 9.7 | K47: 0.7 | L47: 0.1 | M47: =G47/E47 -> 1.049072265625 | N47: =I47/E47 -> 1.5500488281249998 | O47: 16 | P47: 3.8889 | Q47: 0.5 | R47: 78,98,48
A48: Y4 | B48: RNG | C48: ADC | D48: 0 | E48: 429.3 | F48: 10.1 | G48: 465.3 | H48: 5 | I48: 375.3 | J48: 2.8 | K48: 0.3 | L48: 0.3 | M48: =G48/E48 -> 1.0838574423480083 | N48: =I48/E48 -> 0.87421383647798745 | O48: 8 | P48: 4.5833 | Q48: 0.702 | R48: 429,18,202
A49: xiaohu | B49: RNG | C49: 中单 | D49: 3 | E49: 422.8 | F49: 9.8 | G49: 504 | H49: 26.9 | I49: 494.3 | J49: 18.7 | K49: 0.3 | L49: 0.3 | M49: =G49/E49 -> 1.1920529801324502 | N49: =I49/E49 -> 1.1691106906338695 | O49: 39 | P49: 4.0128 | Q49: 0.688 | R49: 13268134.
A50: Uzi | B50: RNG | C50: ADC | D50: 6 | E50: 483.3 | F50: 11.3 | G50: 700.2 | H50: 19.3 | I50: 338.3 | J50: 6.6 | K50: 0.4 | L50: 0.5 | M50: =G50/E50 -> 1.4487895716945998 | N50: =I50/E50 -> 0.69997930891785642 | O50: 21 | P50: 6.1563 | Q50: 0.718 | R50: 81,22,15
A51: MLXG | B51: RNG | C51: 打野 | D51: 4 | E51: 352.9 | F51: 5.4 | G51: 262.9 | H51: 6.6 | I51: 805.8 | J51: 14.5 | K51: 1.2 | L51: 0.4 | M51: =G51/E51 -> 0.74497024652876165 | N51: =I51/E51 -> 2.2833663927458203 | O51: 18 | P51: 4.3784 | Q51: 0.762 | R51: 79,60,421
A52: Ming | B52: RNG | C52: 辅助 | D52: 2 | E52: 276.8 | F52: 2.1 | G52: 133.6 | H52: 7.1 | I52: 449.8 | J52: 17 | K52: 1.6 | L52: 0.3 | M52: =G52/E52 -> 0.48265895953757221 | N52: =I52/E52 -> 1.625 | O52: 39 | P52: 4.0741 | Q52: 0.727 | R52: 201,12,412
A53: LetMe | B53: RNG | C53: 上单 | D53: 1 | E53: 396.8 | F53: 8.7 | G53: 398.8 | H53: 12.7 | I53: 565.4 | J53: 12.7 | K53: 0.5 | L53: 0.1 | M53: =G53/E53 -> 1.0050403225806452 | N53: =I53/E53 -> 1.424899193548387 | O53: 23 | P53: 3.3617 | Q53: 0.634 | R53: 68,164,59
A54: Karsa | B54: RNG | C54: 打野 | D54: 2 | E54: 342 | F54: 5.3 | G54: 234.4 | H54: 6.5 | I54: 752.5 | J54: 15 | K54: 1.4 | L54: 0.5 | M54: =G54/E54 -> 0.68538011695906431 | N54: =I54/E54 -> 2.2002923976608186 | O54: 21 | P54: 4.5 | Q54: 0.718 | R54: 64104113.
A55: Able | B55: RNG | C55: ADC | D55: 1 | E55: 452.8 | F55: 10.7 | G55: 409.1 | H55: 6.1 | I55: 240.8 | J55: 2.5 | K55: 0.3 | L55: 0.5 | M55: =G55/E55 -> 0.9034893992932862 | N55: =I55/E55 -> 0.53180212014134276 | O55: 10 | P55: 5.4286 | Q55: 0.609 | R55: 81,498,51
A56: Xiyang | B56: OMG | C56: 上单 | D56: 1 | E56: 386 | F56: 8.6 | G56: 412.2 | H56: 22.3 | I56: 647.9 | J56: 22 | K56: 0.5 | L56: 0.2 | M56: =G56/E56 -> 1.0678756476683937 | N56: =I56/E56 -> 1.6784974093264249 | O56: 33 | P56: 3.1719 | Q56: 0.635 | R56: 57,98,78
A57: World6 | B57: OMG | C57: 打野 | D57: 1 | E57: 301.9 | F57: 4.5 | G57: 221.7 | H57: 6.6 | I57: 849.3 | J57: 16.1 | K57: 1.2 | L57: 0.4 | M57: =G57/E57 -> 0.73434912222590265 | N57: =I57/E57 -> 2.8131831732361712 | O57: 18 | P57: 1.8261 | Q57: 0.708 | R57: 64,60,79
A58: Maestr0 | B58: OMG | C58: 辅助 | D58: 0 | E58: 229.9 | F58: 1.7 | G58: 124.4 | H58: 1 | I58: 517.3 | J58: 2.8 | K58: 1.4 | L58: 0.2 | M58: =G58/E58 -> 0.5411048281861679 | N58: =I58/E58 -> 2.250108742931709 | O58: 6 | P58: 1.3 | Q58: 0.805 | R58: 201,12,223
A59: Jiekou | B59: OMG | C59: 打野 | D59: 0 | E59: 284 | F59: 5.5 | G59: 137.4 | H59: 0.5 | I59: 766.9 | J59: 1.9 | K59: 1.1 | L59: 0.2 | M59: =G59/E59 -> 0.48380281690140847 | N59: =I59/E59 -> 2.7003521126760561 | O59: 3 | P59: 0.8 | Q59: 0.553 | R59: 60,421,79
A60: Icon | B60: OMG | C60: 中单 | D60: 3 | E60: 408.1 | F60: 9.7 | G60: 484.2 | H60: 27.4 | I60: 505.6 | J60: 18 | K60: 0.5 | L60: 0.1 | M60: =G60/E60 -> 1.1864739034550353 | N60: =I60/E60 -> 1.2389120313648616 | O60: 35 | P60: 2.85 | Q60: 0.659 | R60: 7134268.
A61: Five | B61: OMG | C61: 辅助 | D61: 0 | E61: 273.8 | F61: 2.4 | G61: 143.3 | H61: 6.8 | I61: 502 | J61: 15.1 | K61: 1.4 | L61: 0.4 | M61: =G61/E61 -> 0.52337472607742885 | N61: =I61/E61 -> 1.83345507669832 | O61: 29 | P61: 1.9158 | Q61: 0.614 | R61: 412201117.
A62: Fireloli | B62: OMG | C62: 打野 | D62: 1 | E62: 303.6 | F62: 4.7 | G62: 194.9 | H62: 4.6 | I62: 780.9 | J62: 11.7 | K62: 1.1 | L62: 0.5 | M62: =G62/E62 -> 0.6419631093544137 | N62: =I62/E62 -> 2.5721343873517784 | O62: 15 | P62: 2.0208 | Q62: 0.702 | R62: 64121104.
A63: Chelly | B63: OMG | C63: ADC | D63: 3 | E63: 420.8 | F63: 9.9 | G63: 534.1 | H63: 29.6 | I63: 308.8 | J63: 10.7 | K63: 0.3 | L63: 0.4 | M63: =G63/E63 -> 1.2692490494296578 | N63: =I63/E63 -> 0.73384030418250956 | O63: 34 | P63: 3.1282 | Q63: 0.733 | R63: 110429498.
A64: CAsual | B64: OMG | C64: 上单 | D64: 0 | E64: 343.7 | F64: 8 | G64: 289 | H64: 0.7 | I64: 782.5 | J64: 1.2 | K64: 0.4 | L64: 0 | M64: =G64/E64 -> 0.84084957812045391 | N64: =I64/E64 -> 2.2766947919697413 | O64: 2 | P64: 0.4 | Q64: 0.35 | R64: 59,41,266
A65: Yuuki | B65: LGD | C65: 中单 | D65: 0 | E65: 405.5 | F65: 9.6 | G65: 542.9 | H65: 23.1 | I65: 476.5 | J65: 13.9 | K65: 0.2 | L65: 0.3 | M65: =G65/E65 -> 1.3388409371146732 | N65: =I65/E65 -> 1.1750924784217016 | O65: 34 | P65: 2.663 | Q65: 0.666 | R65: 13,268,42
A66: Pyl | B66: LGD | C66: 辅助 | D66: 2 | E66: 274.9 | F66: 2.3 | G66: 146.5 | H66: 7.3 | I66: 499.8 | J66: 17.2 | K66: 1.5 | L66: 0.4 | M66: =G66/E66 -> 0.53292106220443802 | N66: =I66/E66 -> 1.8181156784285197 | O66: 40 | P66: 2.4553 | Q66: 0.643 | R66: 201,412,12
A67: nanzhu | B67: LGD | C67: 中单 | D67: 1 | E67: 406.8 | F67: 9.2 | G67: 418.8 | H67: 3.2 | I67: 363.9 | J67: 1.9 | K67: 0.3 | L67: 0.2 | M67: =G67/E67 -> 1.0294985250737463 | N67: =I67/E67 -> 0.89454277286135686 | O67: 6 | P67: 2.4667 | Q67: 0.501 | R67: 163,7,112
A68: Jinoo | B68: LGD | C68: 上单 | D68: 1 | E68: 426.4 | F68: 9.3 | G68: 520.9 | H68: 26.2 | I68: 703.8 | J68: 24.3 | K68: 0.5 | L68: 0.2 | M68: =G68/E68 -> 1.2216228893058161 | N68: =I68/E68 -> 1.6505628517823641 | O68: 40 | P68: 3.0349 | Q68: 0.63 | R68: 68,41,164
A69: Intruder | B69: LGD | C69: 打野 | D69: 0 | E69: 313.1 | F69: 4.7 | G69: 229.2 | H69: 2.4 | I69: 833.7 | J69: 6 | K69: 1.1 | L69: 0.5 | M69: =G69/E69 -> 0.73203449377195773 | N69: =I69/E69 -> 2.6627275630788887 | O69: 8 | P69: 3 | Q69: 0.572 | R69: 60121120.
A70: imp | B70: LGD | C70: ADC | D70: 3 | E70: 441.3 | F70: 10.2 | G70: 653.5 | H70: 19.3 | I70: 376.6 | J70: 7.6 | K70: 0.4 | L70: 0.4 | M70: =G70/E70 -> 1.4808520280987989 | N70: =I70/E70 -> 0.8533877181055971 | O70: 24 | P70: 3.0385 | Q70: 0.565 | R70: 15,96,29
A71: Fdy | B71: LGD | C71: ADC | D71: 1 | E71: 424.2 | F71: 10 | G71: 521.6 | H71: 10.7 | I71: 421.2 | J71: 5.9 | K71: 0.3 | L71: 0.3 | M71: =G71/E71 -> 1.2296086751532298 | N71: =I71/E71 -> 0.99292786421499291 | O71: 16 | P71: 3.4722 | Q71: 0.56 | R71: 498,110,81
A72: Eimy | B72: LGD | C72: 打野 | D72: 5 | E72: 314.6 | F72: 4.8 | G72: 187 | H72: 7.4 | I72: 832.9 | J72: 22.7 | K72: 1.5 | L72: 0.6 | M72: =G72/E72 -> 0.59440559440559437 | N72: =I72/E72 -> 2.6474888747616019 | O72: 32 | P72: 2.9103 | Q72: 0.662 | R72: 60,421,79
A73: Zoom | B73: JDG | C73: 上单 | D73: 3 | E73: 415.9 | F73: 9.3 | G73: 463.1 | H73: 24.1 | I73: 645.9 | J73: 24.3 | K73: 0.6 | L73: 0.1 | M73: =G73/E73 -> 1.1134888194277472 | N73: =I73/E73 -> 1.5530175522962251 | O73: 39 | P73: 4.0299 | Q73: 0.618 | R73: 164,150,57
A74: YaGao | B74: JDG | C74: 中单 | D74: 2 | E74: 406.6 | F74: 9.2 | G74: 559.3 | H74: 29.1 | I74: 438.7 | J74: 16.5 | K74: 0.4 | L74: 0.3 | M74: =G74/E74 -> 1.3755533694048203 | N74: =I74/E74 -> 1.0789473684210524 | O74: 39 | P74: 4.274 | Q74: 0.738 | R74: 3,61,268
A75: Xiaohan | B75: JDG | C75: 打野 | D75: 1 | E75: 329.1 | F75: 5.6 | G75: 200 | H75: 1.4 | I75: 668 | J75: 3.4 | K75: 1.9 | L75: 0.6 | M75: =G75/E75 -> 0.60771801883925858 | N75: =I75/E75 -> 2.0297781829231236 | O75: 5 | P75: 4.75 | Q75: 0.83 | R75: 60,121,79
A76: RD | B76: JDG | C76: ADC | D76: 1 | E76: 437.2 | F76: 9.8 | G76: 555.1 | H76: 13.7 | I76: 344.9 | J76: 6.1 | K76: 0.3 | L76: 0.3 | M76: =G76/E76 -> 1.2696706312900274 | N76: =I76/E76 -> 0.78888380603842634 | O76: 19 | P76: 4.5143 | Q76: 0.725 | R76: 110,51,22
A77: LvMao | B77: JDG | C77: 辅助 | D77: 0 | E77: 271 | F77: 1.6 | G77: 112 | H77: 5.8 | I77: 420.5 | J77: 15.8 | K77: 1.3 | L77: 0.2 | M77: =G77/E77 -> 0.41328413284132842 | N77: =I77/E77 -> 1.551660516605166 | O77: 39 | P77: 3.725 | Q77: 0.695 | R77: 201,12,223
A78: Loken | B78: JDG | C78: ADC | D78: 2 | E78: 449.8 | F78: 10.4 | G78: 577.5 | H78: 15.7 | I78: 325.8 | J78: 6.4 | K78: 0.3 | L78: 0.4 | M78: =G78/E78 -> 1.2839039573143618 | N78: =I78/E78 -> 0.72432192085371272 | O78: 20 | P78: 6.913 | Q78: 0.753 | R78: 429,110,96
A79: Clid | B79: JDG | C79: 打野 | D79: 10 | E79: 329.8 | F79: 4.9 | G79: 222.8 | H79: 10 | I79: 839.7 | J79: 27.3 | K79: 1.3 | L79: 0.5 | M79: =G79/E79 -> 0.67556094602789574 | N79: =I79/E79 -> 2.5460885385081866 | O79: 34 | P79: 3.76 | Q79: 0.732 | R79: 64121107.
A80: TheShy | B80: iG | C80: 上单 | D80: 3 | E80: 450.9 | F80: 9 | G80: 607.7 | H80: 23.3 | I80: 712.3 | J80: 23.1 | K80: 0.6 | L80: 0.1 | M80: =G80/E80 -> 1.3477489465513419 | N80: =I80/E80 -> 1.5797294300288311 | O80: 32 | P80: 3.6806 | Q80: 0.527 | R80: 150164126.
A81: Rookie | B81: iG | C81: 中单 | D81: 6 | E81: 451.9 | F81: 9.6 | G81: 654.2 | H81: 27.3 | I81: 395.2 | J81: 14 | K81: 0.3 | L81: 0.2 | M81: =G81/E81 -> 1.4476654127019253 | N81: =I81/E81 -> 0.87452976322195175 | O81: 35 | P81: 6.2419 | Q81: 0.738 | R81: 61112134.
A82: Ning | B82: iG | C82: 打野 | D82: 10 | E82: 365 | F82: 5.3 | G82: 249.4 | H82: 9.9 | I82: 836.8 | J82: 28.3 | K82: 1.3 | L82: 0.4 | M82: =G82/E82 -> 0.6832876712328767 | N82: =I82/E82 -> 2.2926027397260271 | O82: 34 | P82: 5.6615 | Q82: 0.738 | R82: 79,59,113
A83: KidKid | B83: iG | C83: 打野 | D83: 0 | E83: 363.4 | F83: 4.2 | G83: 331.3 | H83: 0.5 | I83: 1112.8 | J83: 1.6 | K83: 0.8 | L83: 0.4 | M83: =G83/E83 -> 0.91166758392955427 | N83: =I83/E83 -> 3.062190423775454 | O83: 1 | P83: 5.75 | Q83: 0.79 | R83: 79,104,60
A84: Jackeylove | B84: iG | C84: ADC | D84: 5 | E84: 482.8 | F84: 10.5 | G84: 717.1 | H84: 29.9 | I84: 407.9 | J84: 14.4 | K84: 0.3 | L84: 0.4 | M84: =G84/E84 -> 1.4852941176470589 | N84: =I84/E84 -> 0.84486329743164867 | O84: 35 | P84: 4.8082 | Q84: 0.656 | R84: 110,81,18
A85: Duke | B85: iG | C85: 上单 | D85: 0 | E85: 358.7 | F85: 8.3 | G85: 434.8 | H85: 1.4 | I85: 654.2 | J85: 1.8 | K85: 0.4 | L85: 0 | M85: =G85/E85 -> 1.2121550041817675 | N85: =I85/E85 -> 1.8238081962642878 | O85: 3 | P85: 2.5 | Q85: 0.596 | R85: 98,57,68
A86: baolan | B86: iG | C86: 辅助 | D86: 7 | E86: 306.5 | F86: 2.5 | G86: 175.7 | H86: 7.3 | I86: 462.4 | J86: 16.3 | K86: 1.6 | L86: 0.3 | M86: =G86/E86 -> 0.57324632952691679 | N86: =I86/E86 -> 1.5086460032626428 | O86: 35 | P86: 5.7619 | Q86: 0.685 | R86: 201,223,12
A87: Pepper | B87: FPX | C87: 打野 | D87: 7 | E87: 331.9 | F87: 5 | G87: 236.4 | H87: 12.3 | I87: 775.8 | J87: 27.8 | K87: 1.8 | L87: 0.5 | M87: =G87/E87 -> 0.71226272973787297 | N87: =I87/E87 -> 2.3374510394697197 | O87: 37 | P87: 3.202 | Q87: 0.701 | R87: 64,59,121
A88: Lwx | B88: FPX | C88: ADC | D88: 4 | E88: 453.4 | F88: 10.2 | G88: 599.1 | H88: 31.4 | I88: 380.6 | J88: 13.6 | K88: 0.3 | L88: 0.3 | M88: =G88/E88 -> 1.3213498014997795 | N88: =I88/E88 -> 0.83943537715041916 | O88: 37 | P88: 3.9882 | Q88: 0.703 | R88: 51,110,96
A89: Gimgoon | B89: FPX | C89: 上单 | D89: 1 | E89: 395.9 | F89: 8.5 | G89: 457.3 | H89: 23.9 | I89: 685.5 | J89: 24.6 | K89: 0.6 | L89: 0.1 | M89: =G89/E89 -> 1.1550896691083608 | N89: =I89/E89 -> 1.7314978529931802 | O89: 37 | P89: 2.7841 | Q89: 0.555 | R89: 114,150,57
A90: Crisp | B90: FPX | C90: 辅助 | D90: 2 | E90: 271.2 | F90: 1.9 | G90: 142.9 | H90: 7.4 | I90: 481.8 | J90: 17.3 | K90: 1.6 | L90: 0.3 | M90: =G90/E90 -> 0.5269174041297936 | N90: =I90/E90 -> 1.7765486725663717 | O90: 37 | P90: 3.1698 | Q90: 0.714 | R90: 201497223.
A91: Cool | B91: FPX | C91: 中单 | D91: 1 | E91: 420.9 | F91: 9.6 | G91: 385.5 | H91: 3 | I91: 364.6 | J91: 1.9 | K91: 0.3 | L91: 0.3 | M91: =G91/E91 -> 0.91589451176051329 | N91: =I91/E91 -> 0.86623901164172024 | O91: 5 | P91: 6.7143 | Q91: 0.656 | R91: 69,61,163
A92: bing | B92: FPX | C92: 中单 | D92: 2 | E92: 393.4 | F92: 8.8 | G92: 486.9 | H92: 21.6 | I92: 475.8 | J92: 14.5 | K92: 0.6 | L92: 0.2 | M92: =G92/E92 -> 1.2376715810879513 | N92: =I92/E92 -> 1.2094560244026438 | O92: 32 | P92: 2.9888 | Q92: 0.657 | R92: 13268163.
A93: scout | B93: EDG | C93: 中单 | D93: 3 | E93: 442.4 | F93: 10.3 | G93: 538 | H93: 28.5 | I93: 437.6 | J93: 16.6 | K93: 0.4 | L93: 0.3 | M93: =G93/E93 -> 1.2160940325497289 | N93: =I93/E93 -> 0.98915009041591329 | O93: 40 | P93: 4.2361 | Q93: 0.7 | R93: 13268163.
A94: Ray | B94: EDG | C94: 上单 | D94: 4 | E94: 380.1 | F94: 8.2 | G94: 404.1 | H94: 21.4 | I94: 636.8 | J94: 24.2 | K94: 0.6 | L94: 0.1 | M94: =G94/E94 -> 1.0631412786108918 | N94: =I94/E94 -> 1.6753485924756641 | O94: 40 | P94: 3.1053 | Q94: 0.535 | R94: 57516150.
A95: meiko | B95: EDG | C95: 辅助 | D95: 2 | E95: 286.4 | F95: 2.2 | G95: 156.3 | H95: 8.3 | I95: 436.8 | J95: 16.6 | K95: 1.4 | L95: 0.2 | M95: =G95/E95 -> 0.54574022346368722 | N95: =I95/E95 -> 1.5251396648044695 | O95: 40 | P95: 4.4 | Q95: 0.706 | R95: 201,12,412
A96: IBoy | B96: EDG | C96: ADC | D96: 6 | E96: 463.5 | F96: 10.8 | G96: 633.4 | H96: 31.8 | I96: 354.9 | J96: 12.8 | K96: 0.4 | L96: 0.6 | M96: =G96/E96 -> 1.3665587918015103 | N96: =I96/E96 -> 0.7656957928802588 | O96: 38 | P96: 5.1379 | Q96: 0.728 | R96: 81,110,18
A97: Hopezz | B97: EDG | C97: ADC | D97: 1 | E97: 430.4 | F97: 11 | G97: 383.4 | H97: 1 | I97: 252.8 | J97: 0.5 | K97: 0.3 | L97: 0.5 | M97: =G97/E97 -> 0.89079925650557623 | N97: =I97/E97 -> 0.58736059479553904 | O97: 2 | P97: 4.5 | Q97: 0.505 | R97: 96
A98: Haro | B98: EDG | C98: 打野 | D98: 8 | E98: 317.2 | F98: 4.7 | G98: 164.1 | H98: 8.7 | I98: 764.2 | J98: 29.1 | K98: 1.6 | L98: 0.4 | M98: =G98/E98 -> 0.51733921815889028 | N98: =I98/E98 -> 2.4092055485498109 | O98: 40 | P98: 3.3659 | Q98: 0.664 | R98: 113,59,121
A99: Sks | B99: BLG | C99: 打野 | D99: 6 | E99: 331.5 | F99: 5.2 | G99: 200.3 | H99: 8.3 | I99: 792.5 | J99: 24.3 | K99: 1.6 | L99: 0.4 | M99: =G99/E99 -> 0.60422322775263959 | N99: =I99/E99 -> 2.3906485671191553 | O99: 30 | P99: 3.4355 | Q99: 0.702 | R99: 113107121.
A100: Road | B100: BLG | C100: 辅助 | D100: 2 | E100: 290.7 | F100: 2.5 | G100: 173.2 | H100: 8.2 | I100: 497 | J100: 17.4 | K100: 1.3 | L100: 0.4 | M100: =G100/E100 -> 0.59580323357413134 | N100: =I100/E100 -> 1.7096663226694186 | O100: 34 | P100: 3.2892 | Q100: 0.772 | R100: 201432412.
A101: mole | B101: BLG | C101: 中单 | D101: 0 | E101: 394.1 | F101: 9 | G101: 547.6 | H101: 2.6 | I101: 402.5 | J101: 1.4 | K101: 0.2 | L101: 0.2 | M101: =G101/E101 -> 1.3894950520172544 | N101: =I101/E101 -> 1.0213143872113677 | O101: 3 | P101: 8 | Q101: 0.58 | R101: 13,14,142
A102: jinjiao | B102: BLG | C102: ADC | D102: 3 | E102: 423.2 | F102: 9.5 | G102: 608.1 | H102: 29.1 | I102: 308.4 | J102: 10.8 | K102: 0.3 | L102: 0.4 | M102: =G102/E102 -> 1.4369092627599245 | N102: =I102/E102 -> 0.72873345935727785 | O102: 34 | P102: 4.3065 | Q102: 0.751 | R102: 202,15,51
A103: Chieftain | B103: BLG | C103: 打野 | D103: 1 | E103: 312.5 | F103: 5.2 | G103: 211.8 | H103: 1.2 | I103: 793.9 | J103: 3.5 | K103: 0.9 | L103: 0.5 | M103: =G103/E103 -> 0.67776 | N103: =I103/E103 -> 2.54048 | O103: 4 | P103: 3.4 | Q103: 0.757 | R103: 113,121,72
A104: Athena | B104: BLG | C104: 中单 | D104: 3 | E104: 410.9 | F104: 9.7 | G104: 576.5 | H104: 24.7 | I104: 410.3 | J104: 12.9 | K104: 0.5 | L104: 0.3 | M104: =G104/E104 -> 1.4030177658797762 | N104: =I104/E104 -> 0.99853979070333421 | O104: 31 | P104: 4.0741 | Q104: 0.654 | R104: 61,163,38
A105: AmazingJ | B105: BLG | C105: 上单 | D105: 3 | E105: 409.4 | F105: 8.4 | G105: 532 | H105: 25.4 | I105: 832.7 | J105: 29.3 | K105: 0.6 | L105: 0.1 | M105: =G105/E105 -> 1.2994626282364437 | N105: =I105/E105 -> 2.0339521250610653 | O105: 34 | P105: 4.129 | Q105: 0.655 | R105: 111245164.